Article_ID,Date,Source,Title,Content_Snippet,Entity_Mentioned,Sector,Sentiment_Score,Sentiment_Label,Language
3d225c69-a794-4719-9fae-dc4f03901bdf,2024-10-03,Facebook News Pages,Mashreq Bank announces overhaul to licensing,industry reports show that supply has increased by 14% compared to last year.,Mashreq Bank,Finance,0.68,Positive,English
58a660e5-5d59-4af0-bb65-eec7e2a614a7,2022-08-10,Gulf News,Dubai Tech sector grows by 14%,Souq.com has announced an innovative solution in its latest move to boost growth.,Souq.com,Tech,0.88,Positive,English
16515d39-86e4-4d28-b92d-558055b2437a,2023-03-22,WAM (UAE News Agency),Dubai Islamic Bank reports record results in annual results,Dubai Islamic Bank has announced a major expansion in its latest move to enhance services.,Dubai Islamic Bank,Finance,0.18,Neutral,English
7be9c6a1-c1e4-4ac1-b78c-e8c7339a68cc,2021-10-02,Gulf News,app launches in UAE with enhanced security,"In a recent interview, Director stated that AI Ministry will hire more staff in the coming months.",AI Ministry,Tech,0.81,Positive,English
be1d1eca-892b-46c9-9834-87004b0c0c46,2021-05-21,Gulf News,Dubai apartment prices stabilize by 5%,"In a recent interview, Minister stated that Dubai South will review policies in the coming months.",Dubai South,Real Estate,0.16,Neutral,English
c12aaf9e-9ba4-43b0-b596-5440b0a35ad4,2022-09-25,Arab News,.ﺔﻛﺮﺷ ﻉﻭﺮﺸﻣ ﻮﻤﻧ ﺕﺍﺭﺎﻣﻻﺍ ﺔﻗﺎﻃ ﻕﻮﺳ ﺔﻴﻟﺎﻣ ﺩﺎﺼﺘﻗﺍ,.ﻮﻤﻧ ﺎﻴﺟﻮﻟﻮﻨﻜﺗ ﺔﺣﺎﻴﺳ ﺔﻛﺮﺷ ﺔﻗﺎﻃ ﻉﻭﺮﺸﻣ ﻕﻮﺳ ﺭﻮﻄﺗ ﺩﺎﺼﺘﻗﺍ ﺔﻴﻟﺎﻣ,AI Ministry,Tech,0.24,Neutral,Arabic
ce5b6311-ebeb-4787-94b4-9bef8c20a891,2024-02-29,Emirates 24/7,DP World announces new mega project in Downtown Dubai,"In a recent interview, Analyst stated that DP World will review policies in the coming months.",DP World,Real Estate,0.35,Positive,English
fdbbfe0e-4ff1-4e5d-8ea7-d6edb6731caf,2025-04-30,Arab News,Dubai South announces new mega project in Business Bay,The law introduced by Federal Authority is expected to regulate the real estate sector.,Dubai South,Real Estate,0.26,Neutral,English
0b97dd26-e52c-45bb-be12-e234359e2a37,2020-06-22,Emirates 24/7,.ﺩﺎﺼﺘﻗﺍ ﻉﻭﺮﺸﻣ ﺭﺎﻤﺜﺘﺳﺍ ﺕﺍﺭﺎﻘﻋ ﺔﻛﺮﺷ,.ﺕﺍﺭﺎﻣﻻﺍ ﺔﻗﺎﻃ ﺕﺍﺭﺎﻘﻋ ﻮﻤﻧ ﺔﻛﺮﺷ ﻉﻭﺮﺸﻣ ﺔﺣﺎﻴﺳ ﺩﺎﺼﺘﻗﺍ ﻉﺎﻄﻗ,TAQA,Energy,-0.17,Neutral,Arabic
3b8de822-8c62-4a5d-9159-0f00ff9133f7,2022-05-31,Zawya,.ﺔﺣﺎﻴﺳ ﺔﻛﺮﺷ ﺩﺎﺼﺘﻗﺍ ﺎﻴﺟﻮﻟﻮﻨﻜﺗ ﺕﺍﺭﺎﻣﻻﺍ,.ﻮﻤﻧ ﺎﻴﺟﻮﻟﻮﻨﻜﺗ ﺔﻴﻟﺎﻣ ﺕﺍﺭﺎﻘﻋ ﻲﺑﺩ ﺩﺎﺼﺘﻗﺍ ﺔﻗﺎﻃ,AI Ministry,Tech,0.55,Positive,Arabic
23e2e368-f55f-491d-9056-6c3580a4cec8,2024-06-29,Arab News,.ﻉﻭﺮﺸﻣ ﺭﺎﻤﺜﺘﺳﺍ ﺩﺎﺼﺘﻗﺍ ﺕﺍﺭﺎﻣﻻﺍ ﺔﻗﺎﻃ ﺔﻴﻟﺎﻣ ﺭﻮﻄﺗ ﺔﺣﺎﻴﺳ,.ﺔﻴﻟﺎﻣ ﻉﺎﻄﻗ ﺔﺣﺎﻴﺳ ﺭﺎﻤﺜﺘﺳﺍ ﺕﺍﺭﺎﻘﻋ ﻕﻮﺳ ﺩﺎﺼﺘﻗﺍ ﻮﻤﻧ,BitOasis (Crypto),Finance,0.82,Positive,Arabic
87083da2-3aa1-44c4-bad8-ddbcf9cc2bbc,2021-08-14,Emirates 24/7,Dubai welcomes 17 million tourists in 2020,Expo 2020 has announced new regulations in its latest move to regulate the market.,Expo 2020,Tourism,0.73,Positive,English
d2b1255a-14a0-4ad5-a2cc-feb226477d76,2025-02-20,Dubai Media Office,.ﻕﻮﺳ ﺔﻛﺮﺷ ﺔﺣﺎﻴﺳ ﺩﺎﺼﺘﻗﺍ ﺔﻴﻟﺎﻣ ﻉﻭﺮﺸﻣ ﺎﻴﺟﻮﻟﻮﻨﻜﺗ ﺭﺎﻤﺜﺘﺳﺍ ﻮﻤﻧ,.ﺔﻗﺎﻃ ﺔﻴﻟﺎﻣ ﻉﻭﺮﺸﻣ ﻕﻮﺳ ﺔﺣﺎﻴﺳ ﺕﺍﺭﺎﻣﻻﺍ,DP World,Real Estate,0.38,Positive,Arabic
fa08b37b-b191-40ba-b4e5-6dd53b0ac5fb,2023-10-31,Emirates 24/7,.ﻮﻤﻧ ﺭﻮﻄﺗ ﻉﺎﻄﻗ ﺕﺍﺭﺎﻘﻋ ﻲﺑﺩ ﺔﻗﺎﻃ ﺔﻴﻟﺎﻣ,.ﻮﻤﻧ ﻕﻮﺳ ﺎﻴﺟﻮﻟﻮﻨﻜﺗ ﺩﺎﺼﺘﻗﺍ ﻉﺎﻄﻗ ﺕﺍﺭﺎﻣﻻﺍ ﺔﻛﺮﺷ,Jumeirah Group,Tourism,0.8,Positive,Arabic
e9865ba9-0ee4-47e9-92a9-b0a9c44c7bc7,2024-10-16,Arab News,New directive to impact Real Estate sector,internal reports show that supply has stabilized by 1% compared to last year.,Dubai South,Real Estate,0.21,Neutral,English
237325ae-c78f-46b5-b65f-8fc5012d39e6,2025-03-30,Dubai Media Office,TAQA reports strong growth in revenue,government reports show that prices has fluctuated by 12% compared to last year.,TAQA,Energy,0.48,Positive,English
f840087f-700e-4666-95aa-20d1c6c6beb1,2023-03-01,The National,USD/bonds prices drop amid policy changes,BitOasis (Crypto) has announced an innovative solution in its latest move to regulate the market.,,,0.29,Neutral,English
e0f65df1-b695-4c1b-8501-f5d2e1f4f342,2024-04-21,The National,DIFC reports mixed results in annual results,The law introduced by UAE Central Bank is expected to boost the finance sector.,DIFC,Finance,1.0,Positive,English
18be8ae6-1f22-47a9-907e-c6de91425fb3,2022-06-22,Khaleej Times,.ﻉﺎﻄﻗ ﺭﺎﻤﺜﺘﺳﺍ ﻉﻭﺮﺸﻣ ﺩﺎﺼﺘﻗﺍ ﺔﻗﺎﻃ ﺭﻮﻄﺗ ﻲﺑﺩ ﺔﺣﺎﻴﺳ,.ﺔﻴﻟﺎﻣ ﺔﺣﺎﻴﺳ ﺔﻛﺮﺷ ﺭﻮﻄﺗ ﻉﺎﻄﻗ ﺭﺎﻤﺜﺘﺳﺍ ﺕﺍﺭﺎﻣﻻﺍ,Careem,Tech,0.65,Positive,Arabic
8c6bee16-6a20-4f79-ae02-75dc2bd5485b,2022-10-04,Dubai Media Office,DP World reports strong growth in Q3 results,The framework introduced by UAE Central Bank is expected to boost the real estate sector.,DP World,Real Estate,0.13,Neutral,English
29673692-afb9-4baf-b972-1e659c42352e,2023-05-12,Khaleej Times,New law to impact Real Estate sector,industry reports show that supply has fluctuated by 44% compared to last year.,DP World,Real Estate,0.36,Positive,English
6825346a-22d5-417f-a305-642420ef0efc,2024-01-18,Zawya,Emaar announces new mega project in Palm Jumeirah,The regulation introduced by Federal Authority is expected to boost the real estate sector.,Emaar,Real Estate,0.18,Neutral,English
1dce181a-297f-46a7-b53c-52eb004b4d77,2024-06-21,Bloomberg MENA,Careem raises $75 in Series B funding,third-party reports show that prices has stabilized by 47% compared to last year.,Careem,Tech,1.0,Positive,English
a1e372f0-e10a-41e4-8bc4-2135c61944a6,2022-06-05,Khaleej Times,Dubai ranked most improved in global tourism index,internal reports show that growth has fluctuated by 7% compared to last year.,Dubai Tourism,Tourism,0.85,Positive,English
3e0ece57-a979-4a0b-a8d6-cdb70da2c456,2021-10-23,Dubai Chronicle,Dubai townhouse prices surge by 1%,"According to industry experts, the real estate sector is experiencing market correction due to consumer demand.",DP World,Real Estate,0.72,Positive,English
eda20f3c-161d-4572-967b-b531a995d644,2023-05-01,Gulf News,New cloud initiative launched by Souq.com,third-party reports show that supply has decreased by 19% compared to last year.,Souq.com,Tech,0.52,Positive,English
7ef2c899-eef7-4581-9ae0-5de6ae6dee2a,2020-04-28,Facebook News Pages,Masdar signs MoU with international firm for smart city,"According to industry experts, the energy sector is experiencing a slowdown due to consumer demand.",Masdar,Energy,0.05,Neutral,English
fd4440fc-2689-46d9-8f9d-1f7f65a02835,2023-03-22,The National,global trends drives decline to tourism sector,internal reports show that investment has increased by 30% compared to last year.,Jumeirah Group,Tourism,0.64,Positive,English
68cdbc99-a868-4d52-b72b-06cd1a7bd77d,2024-12-28,LinkedIn Influencers,Dubai welcomes 10 million tourists in 2020,government reports show that investment has stabilized by 5% compared to last year.,Expo 2020,Tourism,0.82,Positive,English
5b878678-9ac0-4b52-baf5-ca6d523a5e18,2024-08-27,WAM (UAE News Agency),AED/crypto prices stabilize amid policy changes,internal reports show that supply has decreased by 3% compared to last year.,BitOasis (Crypto),Finance,0.69,Positive,English
bc3bf7f1-6a0e-41c3-92cc-bcb4a2493fdd,2020-03-20,Gulf News,New IoT initiative launched by Careem,The framework introduced by UAE Central Bank is expected to boost the tech sector.,Careem,Tech,0.6,Positive,English
fc7cba6b-4252-451b-98dd-46cf30661c94,2020-02-08,Emirates 24/7,DIFC announces overhaul to licensing,DIFC has announced an innovative solution in its latest move to improve sustainability.,DIFC,Finance,0.32,Neutral,English
0cc72cef-a97c-4e60-a4d6-a3f5e7138e3a,2023-01-22,Zawya,New shopping complex opens in Downtown Dubai,Expo 2020 has announced a major expansion in its latest move to improve sustainability.,Expo 2020,Tourism,0.47,Positive,English
f8a92169-c01c-453a-9099-43be34e4e194,2020-06-18,Zawya,.ﻲﺑﺩ ﺩﺎﺼﺘﻗﺍ ﺔﻛﺮﺷ ﺔﻴﻟﺎﻣ ﻕﻮﺳ ﺎﻴﺟﻮﻟﻮﻨﻜﺗ ﻮﻤﻧ ﻉﺎﻄﻗ,.ﺭﺎﻤﺜﺘﺳﺍ ﺔﻗﺎﻃ ﻉﻭﺮﺸﻣ ﻲﺑﺩ ﺭﻮﻄﺗ ﺎﻴﺟﻮﻟﻮﻨﻜﺗ ﻉﺎﻄﻗ ﻕﻮﺳ ﺕﺍﺭﺎﻘﻋ ﺔﺣﺎﻴﺳ,Nakheel,Real Estate,0.16,Neutral,Arabic
560cad5a-dd84-4427-b63d-f491f69ef8a8,2023-03-13,The National,DIFC launches new app for HNWIs,"In a recent interview, Minister stated that DIFC will expand operations in the coming months.",DIFC,Finance,0.28,Neutral,English
b5753b92-404b-434b-bfee-4c02bfc3f9ea,2025-07-22,Bloomberg MENA,Dubai Tech sector grows by 4%,"According to industry experts, the tech sector is experiencing rapid growth due to government policies.",Souq.com,Tech,0.63,Positive,English
72e1f355-ad65-44ea-92ba-43aaae2ca461,2023-12-10,Dubai Chronicle,Downtown Dubai emerges as new hotspot for penthouse investments,internal reports show that demand has decreased by 21% compared to last year.,DP World,Real Estate,0.32,Neutral,English
bc4c20cf-567c-4b56-94b3-8425bf726356,2025-12-29,Arab News,Careem partners with local startup for smart city,The law introduced by DIFC is expected to regulate the tech sector.,Careem,Tech,0.64,Positive,English
c5788dbe-9a84-42b6-8ed2-0325ca7af6f4,2020-10-20,WAM (UAE News Agency),New blockchain initiative launched by AI Ministry,"In a recent interview, Spokesperson stated that AI Ministry will review policies in the coming months.",AI Ministry,Tech,0.61,Positive,English
217e07fb-5671-42af-adfe-d171ac4169d3,2021-12-16,Khaleej Times,Mashreq Bank announces overhaul to banking,industry reports show that investment has fluctuated by 11% compared to last year.,Mashreq Bank,Finance,0.92,Positive,English
164bcf8e-74c2-4600-a59a-bc35747cd036,2021-11-05,Emirates 24/7,TAQA reports steady performance in output,"In a recent interview, Analyst stated that TAQA will review policies in the coming months.",TAQA,Energy,0.91,Positive,English
c546f049-4fa1-44b1-b389-2154495112f3,2021-06-11,The National,.ﺭﺎﻤﺜﺘﺳﺍ ﺕﺍﺭﺎﻣﻻﺍ ﺔﺣﺎﻴﺳ ﻉﻭﺮﺸﻣ ﺭﻮﻄﺗ ﺔﻛﺮﺷ ﻮﻤﻧ ﺔﻗﺎﻃ ﺔﻴﻟﺎﻣ ﻉﺎﻄﻗ,.ﺭﻮﻄﺗ ﻉﺎﻄﻗ ﻉﻭﺮﺸﻣ ﻮﻤﻧ ﻕﻮﺳ ﺩﺎﺼﺘﻗﺍ ﺔﺣﺎﻴﺳ ﻲﺑﺩ ﺭﺎﻤﺜﺘﺳﺍ,DP World,Real Estate,0.47,Positive,Arabic
bdb95bd7-ddf8-4d1d-888c-bd70783ed4f4,2024-12-18,Emirates 24/7,New IoT initiative launched by G42,G42 has announced record profits in its latest move to enhance services.,G42,Tech,0.62,Positive,English
b372816c-1bf7-42ea-a913-2246bbaa9c54,2020-11-25,Dubai Chronicle,Dubai announces new clean initiative,The framework introduced by DIFC is expected to transform the energy sector.,Masdar,Energy,0.23,Neutral,English
7dab5763-d59d-4dd8-bb83-49ffc017cd61,2021-08-06,Arab News,Nakheel announces new mixed-use project in Dubai Marina,third-party reports show that supply has increased by 19% compared to last year.,,,0.37,Positive,English
e7a6c655-04b4-4eb8-a4b0-680f2f5dc597,2025-10-31,WAM (UAE News Agency),Downtown Dubai emerges as new hotspot for townhouse investments,The regulation introduced by UAE Central Bank is expected to boost the real estate sector.,Dubai South,Real Estate,0.36,Positive,English
4120f39b-6c8a-4625-a8b0-7b7ad6b42ae6,2024-11-02,Arab News,G42 partners with local startup for smart city,industry reports show that supply has decreased by 45% compared to last year.,,,0.49,Positive,English
964c433a-3213-4fd2-ac82-c7c1863c948d,2022-12-13,Arabian Business,AI Ministry raises $366 in Series B funding,"In a recent interview, CEO stated that AI Ministry will hire more staff in the coming months.",AI Ministry,Tech,0.66,Positive,English
6c0af4c4-048b-4a8a-ba0b-036fce6b9d69,2025-07-15,Gulf News,Nakheel reports strong growth in Q2 results,The regulation introduced by UAE Central Bank is expected to boost the real estate sector.,Nakheel,Real Estate,0.46,Positive,English
521b71f8-bd21-4c15-bf81-319384a6af93,2025-01-05,Emirates 24/7,New policy to impact Real Estate sector,"In a recent interview, Spokesperson stated that Nakheel will hire more staff in the coming months.",Nakheel,Real Estate,0.5,Positive,English
d731469b-5cbe-4eba-9843-6e7f19e908dd,2022-09-02,Facebook News Pages,Dubai Finance sector sees fluctuate in revenue,"According to industry experts, the finance sector is experiencing strong performance due to technological advancements.",DIFC,Finance,0.81,Positive,English
2018aa5a-f22c-4e02-9702-b8d881c2dc4b,2021-12-13,Arab News,.ﺔﻗﺎﻃ ﻕﻮﺳ ﻉﻭﺮﺸﻣ ﺔﻛﺮﺷ ﺔﻴﻟﺎﻣ ﺭﺎﻤﺜﺘﺳﺍ ﺭﻮﻄﺗ,.ﺕﺍﺭﺎﻣﻻﺍ ﺭﻮﻄﺗ ﺭﺎﻤﺜﺘﺳﺍ ﻉﺎﻄﻗ ﺎﻴﺟﻮﻟﻮﻨﻜﺗ ﺔﻴﻟﺎﻣ ﻲﺑﺩ ﻮﻤﻧ,Masdar,Energy,0.55,Positive,Arabic
df98fd5f-35e3-48cb-bba0-268924a0eaa7,2023-12-24,The National,New regulation to impact Real Estate sector,third-party reports show that growth has increased by 49% compared to last year.,Emaar,Real Estate,0.33,Neutral,English
2c1d2275-86fc-4ac7-aa10-cf0be8bb00b4,2024-06-06,Twitter Threads,Hilton announces expansion with 1 new properties,industry reports show that supply has stabilized by 41% compared to last year.,Dubai Tourism,Tourism,1.0,Positive,English
f331c182-b79b-4af5-bf43-a4154e100548,2024-04-02,Arabian Business,TAQA signs MoU with international firm for innovation hub,"According to industry experts, the energy sector is experiencing strong performance due to economic conditions.",TAQA,Energy,0.66,Positive,English
a27d0220-5d8e-48b2-a633-b2e2ec34d8aa,2023-04-13,Gulf News,New blockchain to reduce water by 13%,"In a recent interview, Spokesperson stated that TAQA will review policies in the coming months.",TAQA,Energy,0.47,Positive,English
7a6a89a0-805d-47c8-90ce-ec6bf0a0a3dc,2020-06-18,Khaleej Times,Emaar announces new commercial project in Dubai Marina,third-party reports show that prices has stabilized by 39% compared to last year.,Emaar,Real Estate,-0.12,Neutral,English
e2de62a3-726c-4b8b-b497-33e1f4596351,2021-10-12,Gulf News,.ﺩﺎﺼﺘﻗﺍ ﺔﺣﺎﻴﺳ ﺭﺎﻤﺜﺘﺳﺍ ﺔﻴﻟﺎﻣ ﺔﻗﺎﻃ,.ﻲﺑﺩ ﺔﻛﺮﺷ ﺔﻴﻟﺎﻣ ﻕﻮﺳ ﻉﺎﻄﻗ ﻉﻭﺮﺸﻣ ﺔﻗﺎﻃ ﺕﺍﺭﺎﻘﻋ,Emaar,Real Estate,0.44,Positive,Arabic
280be754-3904-4159-973e-c4d69434d767,2020-06-12,Bloomberg MENA,New law to impact Real Estate sector,Emaar has announced a major expansion in its latest move to enhance services.,Emaar,Real Estate,-0.2,Neutral,English
79905e4b-3801-45a0-9b65-5b3c7c7ccc6f,2023-05-09,The National,.ﻕﻮﺳ ﻉﺎﻄﻗ ﺔﻴﻟﺎﻣ ﺎﻴﺟﻮﻟﻮﻨﻜﺗ ﺕﺍﺭﺎﻣﻻﺍ ﺭﺎﻤﺜﺘﺳﺍ ﺔﻛﺮﺷ ﺭﻮﻄﺗ ﺕﺍﺭﺎﻘﻋ,.ﻲﺑﺩ ﺔﻛﺮﺷ ﻮﻤﻧ ﺭﻮﻄﺗ ﺕﺍﺭﺎﻘﻋ ﺕﺍﺭﺎﻣﻻﺍ ﻉﻭﺮﺸﻣ ﻕﻮﺳ ﺔﻗﺎﻃ ﺔﺣﺎﻴﺳ,,,0.16,Neutral,Arabic
729f6bc8-5a89-4ff4-83c9-375e5f6e50d5,2023-05-30,Facebook News Pages,.ﺔﻴﻟﺎﻣ ﺔﻗﺎﻃ ﻲﺑﺩ ﺭﻮﻄﺗ ﺔﻛﺮﺷ ﻮﻤﻧ,.ﺔﺣﺎﻴﺳ ﺭﻮﻄﺗ ﻕﻮﺳ ﻉﺎﻄﻗ ﻉﻭﺮﺸﻣ,Expo 2020,Tourism,0.59,Positive,Arabic
23ddf0a7-85bf-4bdc-b3ad-807ab96b0170,2021-02-06,The National,TAQA signs MoU with government for innovation hub,The law introduced by Dubai Government is expected to transform the energy sector.,TAQA,Energy,0.49,Positive,English
ec2b6059-8027-4332-8089-3c2843712e96,2025-11-18,Arabian Business,DP World reports mixed results in Q1 results,industry reports show that growth has fluctuated by 48% compared to last year.,DP World,Real Estate,0.2,Neutral,English
fdcc4ebd-4448-4e52-bd7c-0e6733d20296,2023-10-14,The National,AED/stocks prices drop amid policy changes,"According to industry experts, the finance sector is experiencing a slowdown due to technological advancements.",BitOasis (Crypto),Finance,0.33,Neutral,English
1d5d6990-a9b9-4799-9205-b7da0816bf2c,2022-07-16,WAM (UAE News Agency),.ﺔﺣﺎﻴﺳ ﺔﻛﺮﺷ ﻉﻭﺮﺸﻣ ﻮﻤﻧ ﺕﺍﺭﺎﻣﻻﺍ ﺩﺎﺼﺘﻗﺍ ﺭﺎﻤﺜﺘﺳﺍ ﻲﺑﺩ ﺔﻴﻟﺎﻣ,.ﻉﺎﻄﻗ ﺔﺣﺎﻴﺳ ﻕﻮﺳ ﻮﻤﻧ ﺭﺎﻤﺜﺘﺳﺍ,Emaar,Real Estate,0.43,Positive,Arabic
f839726d-311c-49f6-b93f-93b2537b6a89,2022-06-03,Zawya,Dubai Tech sector grows by 8%,industry reports show that demand has stabilized by 9% compared to last year.,Souq.com,Tech,0.73,Positive,English
82366358-3c0a-4354-8e55-377b225d6bb0,2024-03-07,Arabian Business,Dubai Finance sector sees stabilize in output,third-party reports show that prices has decreased by 26% compared to last year.,Mashreq Bank,Finance,-1.0,Negative,English
2b2e1879-c121-4994-b0bc-f97e3a28098c,2025-10-17,Zawya,Jumeirah announces expansion with 19 new properties,Expo 2020 has announced an innovative solution in its latest move to improve sustainability.,Expo 2020,Tourism,0.67,Positive,English
a740d7c7-90d9-48b2-9951-bad9974731b9,2022-08-07,Arabian Business,.ﺕﺍﺭﺎﻣﻻﺍ ﻮﻤﻧ ﺭﻮﻄﺗ ﺔﻴﻟﺎﻣ ﻲﺑﺩ ﻉﺎﻄﻗ ﺔﻛﺮﺷ,.ﻕﻮﺳ ﺕﺍﺭﺎﻣﻻﺍ ﻉﻭﺮﺸﻣ ﻮﻤﻧ ﻲﺑﺩ ﻉﺎﻄﻗ ﺎﻴﺟﻮﻟﻮﻨﻜﺗ ﺭﺎﻤﺜﺘﺳﺍ ﺔﻛﺮﺷ,,,0.87,Positive,Arabic
dbde66d3-85f7-4068-a1e1-01252c7bed3d,2025-04-21,Zawya,Nakheel announces new residential project in Downtown Dubai,"In a recent interview, Minister stated that Nakheel will invest in R&D in the coming months.",Nakheel,Real Estate,0.24,Neutral,English
84487ae6-f68e-4d51-a069-5f9cc8823bec,2024-11-19,Arab News,DP World announces new mixed-use project in Dubai Marina,"In a recent interview, Analyst stated that DP World will expand operations in the coming months.",DP World,Real Estate,0.29,Neutral,English
51fa864d-c3c8-4fcc-9c4f-b1d11e62fe1b,2024-12-15,Khaleej Times,Nakheel reports strong growth in Q1 results,"According to industry experts, the real estate sector is experiencing a slowdown due to global trends.",Nakheel,Real Estate,0.39,Positive,English
232ca705-2a91-463f-9d61-7429ecd6fd56,2021-02-11,Zawya,Dubai apartment prices fluctuate by 18%,"In a recent interview, Spokesperson stated that Nakheel will review policies in the coming months.",Nakheel,Real Estate,0.34,Positive,English
ac8e4c61-d3db-40d1-805c-58ac31eb7648,2021-01-11,Dubai Media Office,Dubai penthouse prices drop by 24%,"In a recent interview, Director stated that DP World will launch new products in the coming months.",DP World,Real Estate,0.4,Positive,English
4c263c75-c676-4929-a149-52164dfaad5e,2024-02-15,Emirates 24/7,Dubai penthouse prices surge by 4%,DP World has announced an innovative solution in its latest move to boost growth.,DP World,Real Estate,0.2,Neutral,English
ed70f8e1-7b87-49e6-9cf6-fd00f1e58463,2023-02-08,Gulf News,.ﻉﻭﺮﺸﻣ ﺔﻛﺮﺷ ﺕﺍﺭﺎﻘﻋ ﺭﻮﻄﺗ ﺎﻴﺟﻮﻟﻮﻨﻜﺗ ﻉﺎﻄﻗ,.ﺔﻗﺎﻃ ﻲﺑﺩ ﺔﺣﺎﻴﺳ ﺔﻛﺮﺷ ﺕﺍﺭﺎﻘﻋ ﺭﺎﻤﺜﺘﺳﺍ ﻉﻭﺮﺸﻣ ﻮﻤﻧ ﺔﻴﻟﺎﻣ,G42,Tech,0.36,Positive,Arabic
5deb1f87-058e-432d-a531-3dd3985b90a9,2024-11-01,Dubai Chronicle,.ﺭﺎﻤﺜﺘﺳﺍ ﺔﻗﺎﻃ ﻮﻤﻧ ﻲﺑﺩ ﺕﺍﺭﺎﻣﻻﺍ ﻉﺎﻄﻗ ﺕﺍﺭﺎﻘﻋ ﺭﻮﻄﺗ,.ﻕﻮﺳ ﻉﺎﻄﻗ ﺔﺣﺎﻴﺳ ﺔﻗﺎﻃ ﺔﻛﺮﺷ ﻉﻭﺮﺸﻣ ﺭﻮﻄﺗ ﺔﻴﻟﺎﻣ ﺕﺍﺭﺎﻣﻻﺍ ﺎﻴﺟﻮﻟﻮﻨﻜﺗ,DP World,Real Estate,0.33,Neutral,Arabic
e56a7717-ef99-4735-9b65-aa541eb7809e,2020-03-30,The National,DP World reports significant decline in Q1 results,The framework introduced by Dubai Government is expected to boost the real estate sector.,DP World,Real Estate,0.22,Neutral,English
32499b09-0b70-40ff-aaf0-8728f13ab0c6,2024-11-05,Arabian Business,New law to impact Real Estate sector,DP World has announced new regulations in its latest move to regulate the market.,DP World,Real Estate,0.22,Neutral,English
d9caea29-ff63-4e69-861c-7b1f07ee547f,2021-11-23,Dubai Media Office,New policy to impact Real Estate sector,third-party reports show that demand has decreased by 22% compared to last year.,DP World,Real Estate,0.7,Positive,English
ede89fd7-f9e1-4eba-9657-1a53909b585d,2021-06-04,Facebook News Pages,USD/bonds prices stabilize amid policy changes,The policy introduced by Dubai Government is expected to restrict the finance sector.,Dubai Islamic Bank,Finance,0.41,Positive,English
ccc9b0a1-5397-4846-b72e-8d77040dc764,2021-10-27,Arab News,Dubai South reports record results in Q2 results,"In a recent interview, Director stated that Dubai South will expand operations in the coming months.",Dubai South,Real Estate,0.71,Positive,English
0149a90c-fcd9-402a-ac57-7ece50369a22,2022-08-25,Arabian Business,New blockchain initiative launched by G42,"According to industry experts, the tech sector is experiencing strong performance due to government policies.",,,0.59,Positive,English
3d7e3291-631a-4786-ba4f-cc49baa58622,2020-05-19,LinkedIn Influencers,DEWA signs MoU with government for digital transformation,"According to industry experts, the energy sector is experiencing market correction due to economic conditions.",DEWA,Energy,-0.14,Neutral,English
588adbd4-1093-48d6-9d20-f5bdacd5e2dc,2020-04-16,Bloomberg MENA,New theme park opens in Downtown Dubai,"In a recent interview, Analyst stated that Expo 2020 will launch new products in the coming months.",Expo 2020,Tourism,0.45,Positive,English
e79add0f-c767-4aff-b4de-b73962a07c3a,2021-09-15,The National,.ﺭﺎﻤﺜﺘﺳﺍ ﺔﻛﺮﺷ ﺕﺍﺭﺎﻘﻋ ﻕﻮﺳ ﻲﺑﺩ ﺔﺣﺎﻴﺳ ﻮﻤﻧ ﻉﻭﺮﺸﻣ ﺕﺍﺭﺎﻣﻻﺍ,.ﻕﻮﺳ ﻉﻭﺮﺸﻣ ﺕﺍﺭﺎﻣﻻﺍ ﻮﻤﻧ ﺎﻴﺟﻮﻟﻮﻨﻜﺗ ﺭﻮﻄﺗ ﺔﻗﺎﻃ ﺭﺎﻤﺜﺘﺳﺍ ﺩﺎﺼﺘﻗﺍ,Masdar,Energy,0.55,Positive,Arabic
e26ad482-d408-4d27-9c18-ad441ae23f07,2025-01-02,Dubai Chronicle,New policy to impact Real Estate sector,internal reports show that investment has fluctuated by 32% compared to last year.,Dubai South,Real Estate,0.25,Neutral,English
68574c4e-ea7a-4b6c-9d20-8a7fb365ff5a,2021-07-23,WAM (UAE News Agency),DP World reports significant decline in Q4 results,The framework introduced by UAE Central Bank is expected to modernize the real estate sector.,DP World,Real Estate,0.18,Neutral,English
42a6db3a-7a9c-469e-a1bc-d3645be49bab,2020-03-19,Dubai Media Office,New regulation to impact Real Estate sector,The policy introduced by Federal Authority is expected to transform the real estate sector.,Emaar,Real Estate,0.45,Positive,English
825bafd1-beef-4d0a-8c71-515de19c3887,2025-03-10,Gulf News,Jumeirah announces expansion with 7 new properties,The framework introduced by UAE Central Bank is expected to transform the tourism sector.,Expo 2020,Tourism,0.63,Positive,English
e92a63af-ba07-4800-bb63-f2edbcc30727,2023-09-10,Zawya,service launches in UAE with Arabic support,"According to industry experts, the tech sector is experiencing rapid growth due to consumer demand.",Careem,Tech,0.51,Positive,English
b6a01734-dc60-4e51-b56b-9ed3817f53ce,2024-02-07,Dubai Chronicle,.ﺔﻗﺎﻃ ﺎﻴﺟﻮﻟﻮﻨﻜﺗ ﺩﺎﺼﺘﻗﺍ ﺭﺎﻤﺜﺘﺳﺍ ﺔﻴﻟﺎﻣ,.ﺭﺎﻤﺜﺘﺳﺍ ﻉﺎﻄﻗ ﺕﺍﺭﺎﻘﻋ ﻕﻮﺳ ﺔﺣﺎﻴﺳ ﺩﺎﺼﺘﻗﺍ ﺔﻛﺮﺷ ﺔﻴﻟﺎﻣ,Careem,Tech,0.44,Positive,Arabic
24a09a79-18db-4e81-854e-b7ec2f6da3d2,2024-10-17,Gulf News,Dubai townhouse prices stabilize by 9%,government reports show that investment has stabilized by 12% compared to last year.,DP World,Real Estate,0.1,Neutral,English
8fddfa63-9441-424f-81f2-f3035daba7c8,2024-07-26,The National,Dubai Tech sector grows by 20%,"According to industry experts, the tech sector is experiencing unprecedented demand due to government policies.",AI Ministry,Tech,0.62,Positive,English
8842e037-37fc-4786-84f1-7fafa91c9933,2021-12-16,Emirates 24/7,New regulation to impact Real Estate sector,The framework introduced by Federal Authority is expected to regulate the real estate sector.,DP World,Real Estate,0.55,Positive,English
dd0f5604-72cf-41ef-8afe-56c62b6763f4,2022-05-18,Arab News,global trends drives growth to tourism sector,Jumeirah Group has announced an innovative solution in its latest move to expand market share.,Jumeirah Group,Tourism,0.59,Positive,English
5a059111-6669-4153-968e-f49c3bee9014,2024-05-22,The National,Careem partners with local startup for smart city,Careem has announced an innovative solution in its latest move to regulate the market.,Careem,Tech,0.8,Positive,English
747e452c-36ab-45d8-98dd-6c2e8f119861,2024-03-30,Gulf News,Dubai ranked top in global tourism index,"According to industry experts, the tourism sector is experiencing strong performance due to technological advancements.",Jumeirah Group,Tourism,0.77,Positive,English
1f4cb828-7abd-45fc-a601-b3aff731c020,2021-11-19,Zawya,BitOasis (Crypto) launches new platform for HNWIs,BitOasis (Crypto) has announced a major expansion in its latest move to regulate the market.,BitOasis (Crypto),Finance,0.62,Positive,English
e009d4dc-faec-4354-84c0-603bc8a04507,2021-03-31,Khaleej Times,Dubai Tech sector grows by 25%,Souq.com has announced an innovative solution in its latest move to boost growth.,Souq.com,Tech,0.74,Positive,English
