Article_ID,Date,Source,Title,Content_Snippet,Entity_Mentioned,Sector,Sentiment_Score,Sentiment_Label,Language
b96ed327-b493-4405-9d2d-509a19df6fdc,2022-10-15,Bloomberg MENA,Souq.com partners with government for digital transformation,The policy introduced by UAE Central Bank is expected to transform the tech sector.,Souq.com,Tech,0.52,Positive,English
fd4c4ee7-0fcc-44c9-b903-36e8308650d8,2020-06-26,Emirates 24/7,Dubai penthouse prices drop by 19%,Nakheel has announced an innovative solution in its latest move to regulate the market.,Nakheel,Real Estate,-0.24,Neutral,English
6ff65a15-7f72-4f1b-9a00-18ffa15c6862,2020-02-10,LinkedIn Influencers,Dubai apartment prices fluctuate by 27%,Emaar has announced a strategic partnership in its latest move to improve sustainability.,Emaar,Real Estate,0.39,Positive,English
555f264e-fcae-44a2-a8fb-cf77f271af09,2021-10-17,Gulf News,Dubai Tech sector grows by 12%,AI Ministry has announced record profits in its latest move to expand market share.,AI Ministry,Tech,1.0,Positive,English
de9d0a8e-f0bc-4aa4-b339-582d9938170d,2020-07-08,WAM (UAE News Agency),Mashreq Bank launches new app for investors,Mashreq Bank has announced new regulations in its latest move to boost growth.,Mashreq Bank,Finance,0.57,Positive,English
ad7bc9ef-d474-43c7-bc40-02b6129fdc58,2024-06-08,Arab News,AI Ministry partners with local startup for digital transformation,"According to industry experts, the tech sector is experiencing strong performance due to economic conditions.",AI Ministry,Tech,0.99,Positive,English
d74238b6-8fad-4ab4-a019-12ef59409023,2023-06-10,The National,USD/crypto prices drop amid global trends,industry reports show that demand has decreased by 12% compared to last year.,Mashreq Bank,Finance,0.58,Positive,English
5b42686a-1a72-4ad2-9a69-49f3537543db,2023-07-04,Emirates 24/7,.ﺔﻴﻟﺎﻣ ﻕﻮﺳ ﻉﻭﺮﺸﻣ ﺎﻴﺟﻮﻟﻮﻨﻜﺗ ﺩﺎﺼﺘﻗﺍ,.ﺩﺎﺼﺘﻗﺍ ﺭﺎﻤﺜﺘﺳﺍ ﻮﻤﻧ ﻲﺑﺩ ﺔﻗﺎﻃ ﺔﻴﻟﺎﻣ ﺔﻛﺮﺷ ﺕﺍﺭﺎﻣﻻﺍ,Expo 2020,Tourism,0.68,Positive,Arabic
66c06bda-b192-4936-9c2f-cad8a59f67c7,2022-02-07,Dubai Chronicle,New law to impact Real Estate sector,"According to industry experts, the real estate sector is experiencing unprecedented demand due to economic conditions.",DP World,Real Estate,0.14,Neutral,English
e3cdbe4b-6e6a-4115-8b6d-4000bc007af4,2024-03-16,Arab News,Nakheel announces new mega project in Business Bay,industry reports show that investment has stabilized by 11% compared to last year.,Nakheel,Real Estate,0.19,Neutral,English
5d01321a-5a53-4557-852f-44cc92379286,2022-07-22,Emirates 24/7,Nakheel announces new mixed-use project in Dubai Hills,government reports show that supply has increased by 6% compared to last year.,Nakheel,Real Estate,0.39,Positive,English
f3be3d3c-12a9-4ca1-9ff6-825baed8bb39,2021-11-09,Arab News,New shopping complex opens in Palm Jumeirah,Expo 2020 has announced a strategic partnership in its latest move to enhance services.,Expo 2020,Tourism,0.91,Positive,English
2a2e517e-a5bc-4f49-ae8e-78db24e21ca9,2020-11-19,Twitter Threads,DP World announces new residential project in Downtown Dubai,"In a recent interview, Spokesperson stated that DP World will expand operations in the coming months.",DP World,Real Estate,0.33,Neutral,English
9b9014d1-f565-4211-80d6-934abe4e6fd1,2024-04-21,Emirates 24/7,Dubai townhouse prices surge by 25%,"In a recent interview, Spokesperson stated that Dubai South will hire more staff in the coming months.",,Real Estate,0.62,Positive,English
97632bcf-de37-4933-81e6-2a06ec3dbd37,2023-09-07,The National,Mashreq Bank reports record results in annual results,The law introduced by Dubai Government is expected to boost the finance sector.,Mashreq Bank,Finance,0.36,Positive,English
bbb3f002-9e72-4049-934e-c366049e34ee,2020-10-08,Arab News,G42 raises $432 in Series A funding,"According to industry experts, the tech sector is experiencing rapid growth due to technological advancements.",G42,Tech,0.5,Positive,English
e85478e2-c4f8-4c7d-bee8-cf2e50a87046,2024-11-13,Bloomberg MENA,Dubai welcomes 16 million tourists in 2025,Jumeirah Group has announced record profits in its latest move to enhance services.,Jumeirah Group,Tourism,0.72,Positive,English
89cfda6c-4d45-48ac-b3be-73bcae9f2a8e,2025-11-05,Arab News,Energy sector to invest $56 in smart city,The law introduced by UAE Central Bank is expected to boost the energy sector.,TAQA,Energy,0.6,Positive,English
6ac44899-3df4-4d3d-88e7-d9c88f914401,2020-11-18,Bloomberg MENA,New regulation to impact Real Estate sector,"In a recent interview, Minister stated that DP World will launch new products in the coming months.",DP World,Real Estate,0.11,Neutral,English
84230f3f-bdbb-428c-8c82-655df9a6f936,2022-07-06,Khaleej Times,.ﺕﺍﺭﺎﻣﻻﺍ ﺭﺎﻤﺜﺘﺳﺍ ﺔﻴﻟﺎﻣ ﺔﻗﺎﻃ ﻮﻤﻧ,.ﺕﺍﺭﺎﻣﻻﺍ ﻉﻭﺮﺸﻣ ﺔﺣﺎﻴﺳ ﻕﻮﺳ ﺩﺎﺼﺘﻗﺍ ﺔﻴﻟﺎﻣ ﺔﻛﺮﺷ ﻉﺎﻄﻗ,Jumeirah Group,Tourism,0.95,Positive,Arabic
9d363935-ec7c-4745-b7e3-35ddc8c20139,2024-02-26,Bloomberg MENA,G42 partners with local startup for innovation hub,"According to industry experts, the tech sector is experiencing unprecedented demand due to technological advancements.",G42,Tech,0.42,Positive,English
d9d7b65b-5ea0-48bc-9e17-7a85254cc947,2022-09-05,Facebook News Pages,Dubai Marina emerges as new hotspot for apartment investments,Dubai South has announced a strategic partnership in its latest move to enhance services.,Dubai South,Real Estate,0.34,Positive,English
f0fe401b-f67d-4362-aaf7-a0a57d842754,2023-03-06,LinkedIn Influencers,Dubai Hills emerges as new hotspot for villa investments,"According to industry experts, the real estate sector is experiencing rapid growth due to technological advancements.",Emaar,Real Estate,-0.19,Neutral,English
f967c25d-eb61-4d21-a68f-65748d834100,2020-11-05,Bloomberg MENA,service launches in UAE with localized content,government reports show that investment has increased by 26% compared to last year.,Souq.com,Tech,0.48,Positive,English
0713dae8-c3b6-481d-9eac-75be72eea206,2024-04-08,Arab News,Nakheel announces new residential project in Business Bay,Nakheel has announced record profits in its latest move to enhance services.,Nakheel,Real Estate,0.53,Positive,English
2f81caaa-0e14-4383-a799-86a7e9542e3e,2020-10-18,Gulf News,.ﻲﺑﺩ ﺔﻗﺎﻃ ﺩﺎﺼﺘﻗﺍ ﺔﻴﻟﺎﻣ ﺎﻴﺟﻮﻟﻮﻨﻜﺗ ﺔﻛﺮﺷ ﻕﻮﺳ,.ﻕﻮﺳ ﺕﺍﺭﺎﻣﻻﺍ ﺔﺣﺎﻴﺳ ﻮﻤﻧ ﺭﺎﻤﺜﺘﺳﺍ ﻉﺎﻄﻗ ﺩﺎﺼﺘﻗﺍ ﺕﺍﺭﺎﻘﻋ ﺎﻴﺟﻮﻟﻮﻨﻜﺗ ﺔﻴﻟﺎﻣ,,,0.21,Neutral,Arabic
c136b12b-c59c-4530-860c-f694c0651f17,2021-09-03,Dubai Media Office,Dubai announces new renewable initiative,The law introduced by Dubai Government is expected to restrict the energy sector.,Masdar,Energy,0.3,Neutral,English
6bd97b68-1016-462a-b225-ff17b046e916,2024-07-30,Arab News,Nakheel reports strong growth in Q1 results,"In a recent interview, CEO stated that Nakheel will launch new products in the coming months.",Nakheel,Real Estate,0.46,Positive,English
1359f022-0aaa-4ab6-b6f7-39021c3c442c,2022-09-13,Dubai Chronicle,Dubai Marina emerges as new hotspot for villa investments,"In a recent interview, CEO stated that Dubai South will review policies in the coming months.",Dubai South,Real Estate,0.26,Neutral,English
55f70ff5-55bf-4f32-be19-93a609aa1d20,2021-06-28,Dubai Media Office,.ﻉﺎﻄﻗ ﺔﻛﺮﺷ ﺎﻴﺟﻮﻟﻮﻨﻜﺗ ﺔﺣﺎﻴﺳ ﻮﻤﻧ ﺔﻴﻟﺎﻣ,.ﻲﺑﺩ ﺭﺎﻤﺜﺘﺳﺍ ﺕﺍﺭﺎﻘﻋ ﺔﺣﺎﻴﺳ ﺕﺍﺭﺎﻣﻻﺍ ﻉﺎﻄﻗ,Masdar,Energy,0.55,Positive,Arabic
3a7d36fe-b10b-4c98-9864-f4fc65413109,2022-10-03,Dubai Chronicle,New directive to impact Real Estate sector,third-party reports show that supply has fluctuated by 49% compared to last year.,Emaar,Real Estate,0.44,Positive,English
73e9c141-cfbd-4e06-ab48-05c4ad299931,2021-12-17,Dubai Media Office,Energy sector to invest $180 in digital transformation,The law introduced by Federal Authority is expected to regulate the energy sector.,DEWA,Energy,0.98,Positive,English
7367f750-3b16-4f9f-ab6e-1bd493de7f19,2022-02-16,Zawya,DP World reports significant decline in Q2 results,"In a recent interview, Director stated that DP World will expand operations in the coming months.",DP World,Real Estate,0.35,Positive,English
2ed6e2c5-e30a-454e-8415-ed048a195235,2024-05-10,Emirates 24/7,Downtown Dubai emerges as new hotspot for apartment investments,"In a recent interview, Spokesperson stated that DP World will hire more staff in the coming months.",DP World,Real Estate,0.58,Positive,English
ed95eade-351c-4d29-9f05-e5c00b66952b,2023-01-14,Arab News,.ﻲﺑﺩ ﻮﻤﻧ ﺔﻴﻟﺎﻣ ﺭﻮﻄﺗ ﻉﻭﺮﺸﻣ ﺔﻗﺎﻃ ﺎﻴﺟﻮﻟﻮﻨﻜﺗ ﺭﺎﻤﺜﺘﺳﺍ,.ﻕﻮﺳ ﻮﻤﻧ ﻉﻭﺮﺸﻣ ﺕﺍﺭﺎﻣﻻﺍ ﺩﺎﺼﺘﻗﺍ ﺕﺍﺭﺎﻘﻋ ﻲﺑﺩ ﻉﺎﻄﻗ,Mashreq Bank,Finance,0.35,Positive,Arabic
607b3569-8cc3-4d5f-814a-5522ab007307,2025-07-09,Twitter Threads,.ﻕﻮﺳ ﻉﻭﺮﺸﻣ ﻮﻤﻧ ﺔﻛﺮﺷ ﻉﺎﻄﻗ ﺎﻴﺟﻮﻟﻮﻨﻜﺗ ﺔﺣﺎﻴﺳ ﺩﺎﺼﺘﻗﺍ ﻲﺑﺩ ﺕﺍﺭﺎﻘﻋ,.ﺔﻛﺮﺷ ﺭﺎﻤﺜﺘﺳﺍ ﺔﺣﺎﻴﺳ ﺕﺍﺭﺎﻣﻻﺍ ﺔﻴﻟﺎﻣ ﻉﺎﻄﻗ,AI Ministry,Tech,0.54,Positive,Arabic
f654b72a-7ecb-43e4-b230-35403a1501b4,2020-07-17,Bloomberg MENA,Dubai welcomes 12 million tourists in 2022,internal reports show that growth has decreased by 43% compared to last year.,Expo 2020,Tourism,0.51,Positive,English
49efdc3b-d1c1-4227-8e88-3571c7788852,2021-05-23,Arab News,.ﻉﺎﻄﻗ ﺔﻗﺎﻃ ﺎﻴﺟﻮﻟﻮﻨﻜﺗ ﺔﻛﺮﺷ ﺕﺍﺭﺎﻣﻻﺍ ﻲﺑﺩ ﺭﺎﻤﺜﺘﺳﺍ ﺔﻴﻟﺎﻣ ﺕﺍﺭﺎﻘﻋ,.ﻲﺑﺩ ﺔﻛﺮﺷ ﻕﻮﺳ ﺔﺣﺎﻴﺳ ﺭﻮﻄﺗ,G42,Tech,0.77,Positive,Arabic
c1ca1232-76c7-4599-adaf-7740e708e086,2020-08-29,Gulf News,Dubai Finance sector sees surge in revenue,industry reports show that growth has fluctuated by 41% compared to last year.,DIFC,Finance,0.6,Positive,English
cd207da0-882b-4e97-a464-031236988e9c,2022-02-26,Arabian Business,AED/crypto prices surge amid global trends,"In a recent interview, Spokesperson stated that DIFC will review policies in the coming months.",DIFC,Finance,0.69,Positive,English
20ab8a40-1850-42ca-8bc1-f25aed847c18,2022-04-30,Gulf News,.ﺩﺎﺼﺘﻗﺍ ﺎﻴﺟﻮﻟﻮﻨﻜﺗ ﺭﺎﻤﺜﺘﺳﺍ ﻲﺑﺩ ﺔﻗﺎﻃ ﻮﻤﻧ ﻉﺎﻄﻗ ﺔﻛﺮﺷ ﺕﺍﺭﺎﻘﻋ,.ﻲﺑﺩ ﺔﻴﻟﺎﻣ ﺭﻮﻄﺗ ﻮﻤﻧ ﻉﺎﻄﻗ ﺎﻴﺟﻮﻟﻮﻨﻜﺗ ﻉﻭﺮﺸﻣ,DP World,Real Estate,0.11,Neutral,Arabic
30cb9d68-17cd-41ac-baf9-7dd9c4981178,2021-10-06,WAM (UAE News Agency),Dubai villa prices stabilize by 19%,"According to industry experts, the real estate sector is experiencing unprecedented demand due to global trends.",,,0.94,Positive,English
8bf01b14-3f9e-4345-9270-59a3eddf76d1,2023-02-14,Twitter Threads,New directive to impact Real Estate sector,"In a recent interview, Director stated that Dubai South will invest in R&D in the coming months.",Dubai South,Real Estate,-0.21,Neutral,English
952675e0-2fa5-4cc1-a7e4-bd0eac38d477,2021-12-25,Arabian Business,Dubai Islamic Bank reports significant decline in annual results,Dubai Islamic Bank has announced new regulations in its latest move to boost growth.,Dubai Islamic Bank,Finance,1.0,Positive,English
3a9b1e9a-33bb-4513-9485-8f8247c13fda,2025-10-07,Zawya,TAQA signs MoU with government for smart city,government reports show that supply has stabilized by 4% compared to last year.,TAQA,Energy,0.27,Neutral,English
da6cf153-deed-42da-a300-f6bb1982cf9e,2023-06-20,Dubai Chronicle,Nakheel announces new mega project in Dubai Hills,Nakheel has announced new regulations in its latest move to regulate the market.,Nakheel,Real Estate,0.29,Neutral,English
601c3022-d203-4905-bddf-2268327b504b,2022-05-28,Facebook News Pages,Dubai South reports record results in Q1 results,Dubai South has announced a major expansion in its latest move to enhance services.,Dubai South,Real Estate,0.31,Neutral,English
3e0d24d9-8166-4a07-879d-22e8c71217cc,2020-04-23,Khaleej Times,Dubai announces new clean initiative,The law introduced by Federal Authority is expected to transform the energy sector.,DEWA,Energy,-0.08,Neutral,English
69526d8d-13ab-443c-b6a3-e7152fd934ba,2024-06-25,The National,New theme park opens in Dubai Marina,The law introduced by UAE Central Bank is expected to regulate the tourism sector.,Expo 2020,Tourism,0.97,Positive,English
8a8f7c99-087a-4382-9809-bd0d9f6411cb,2023-07-17,Arab News,New theme park opens in Palm Jumeirah,Jumeirah Group has announced a strategic partnership in its latest move to improve sustainability.,,Tourism,0.76,Positive,English
c0c41902-4aa9-4984-be49-f6db3594bf98,2023-09-02,Facebook News Pages,Mashreq Bank announces overhaul to investment,"In a recent interview, Spokesperson stated that Mashreq Bank will invest in R&D in the coming months.",Mashreq Bank,Finance,0.69,Positive,English
44d78b7e-49c1-4a55-b1ab-418f3ca22e87,2024-06-01,Dubai Chronicle,New law to impact Real Estate sector,The law introduced by Dubai Government is expected to regulate the real estate sector.,,Real Estate,0.95,Positive,English
0af79322-b940-41c2-ac5c-321badecfad1,2022-07-22,Facebook News Pages,DP World reports significant decline in Q3 results,DP World has announced a major expansion in its latest move to expand market share.,DP World,Real Estate,0.25,Neutral,English
d7a3055d-3f36-4a3f-a4c0-5f5b126c18cd,2024-12-10,The National,Dubai ranked top in global tourism index,industry reports show that investment has decreased by 48% compared to last year.,Dubai Tourism,Tourism,0.71,Positive,English
6074e94c-8731-47f8-a8e6-2ee24f683fa7,2022-08-15,Zawya,BitOasis (Crypto) announces overhaul to banking,government reports show that supply has decreased by 26% compared to last year.,BitOasis (Crypto),Finance,0.55,Positive,English
58892293-65c9-4f33-b58a-668553110d33,2022-05-14,Bloomberg MENA,Energy sector to invest $126 in digital transformation,"In a recent interview, Director stated that TAQA will hire more staff in the coming months.",TAQA,Energy,0.54,Positive,English
c463c6ac-0e97-49eb-9135-5921bde472dc,2022-08-09,Twitter Threads,Dubai apartment prices stabilize by 30%,industry reports show that growth has decreased by 47% compared to last year.,DP World,Real Estate,0.28,Neutral,English
72869d0b-5ea4-49c3-ab38-d0c06c2cfb8d,2025-01-29,Arab News,app launches in UAE with Arabic support,government reports show that investment has stabilized by 14% compared to last year.,Careem,Tech,0.73,Positive,English
1ddd499b-1a99-441a-b6b2-f84d2c9281b9,2021-09-20,Emirates 24/7,Nakheel reports record results in Q1 results,"According to industry experts, the real estate sector is experiencing unprecedented demand due to economic conditions.",Nakheel,Real Estate,0.46,Positive,English
5793b96b-39c8-404f-8571-bd504c3ca7cd,2021-01-04,LinkedIn Influencers,Dubai apartment prices fluctuate by 23%,"According to industry experts, the real estate sector is experiencing market correction due to global trends.",Dubai South,Real Estate,0.12,Neutral,English
a2f9a2af-a1ca-4b7b-95ea-e9045ed60f3e,2021-10-13,Zawya,New AI to reduce energy by 13%,internal reports show that supply has stabilized by 39% compared to last year.,Masdar,Energy,0.5,Positive,English
b14e6e7a-ac5c-41ea-a7bb-8863a8a24a81,2022-11-13,Emirates 24/7,Emaar reports mixed results in Q2 results,"According to industry experts, the real estate sector is experiencing a slowdown due to government policies.",Emaar,Real Estate,0.34,Positive,English
ac39192b-dea4-4398-b319-bf3488859dc5,2023-02-11,WAM (UAE News Agency),Dubai announces new solar initiative,TAQA has announced a strategic partnership in its latest move to regulate the market.,TAQA,Energy,0.01,Neutral,English
cb4b5057-3109-4381-8f7e-87b75f598cab,2023-05-10,Gulf News,DEWA reports strong growth in revenue,"According to industry experts, the energy sector is experiencing a slowdown due to government policies.",DEWA,Energy,0.34,Positive,English
e8429251-27f5-4270-9178-0c89de5b9fd7,2022-03-16,Dubai Chronicle,Dubai Tech sector grows by 29%,internal reports show that prices has fluctuated by 18% compared to last year.,Careem,Tech,0.68,Positive,English
1ada765e-07ea-40ca-aae1-516e27f8c51f,2025-12-18,The National,Souq.com raises $249 in Series B funding,Souq.com has announced an innovative solution in its latest move to boost growth.,Souq.com,Tech,0.78,Positive,English
ccaad155-c251-44ae-8257-73e1f43292f8,2021-01-16,WAM (UAE News Agency),Dubai South announces new commercial project in Dubai Hills,third-party reports show that prices has increased by 42% compared to last year.,Dubai South,Real Estate,0.41,Positive,English
13dc5712-1000-45c3-b989-9f3d65a61c3f,2022-09-04,Arabian Business,Dubai townhouse prices stabilize by 30%,"According to industry experts, the real estate sector is experiencing unprecedented demand due to economic conditions.",Dubai South,Real Estate,0.18,Neutral,English
82586e2d-bbe7-4633-9007-22559056c29e,2024-04-05,The National,AI Ministry raises $207 in seed funding,"According to industry experts, the tech sector is experiencing a slowdown due to technological advancements.",AI Ministry,Tech,-1.0,Negative,English
7acc7500-253c-4318-9e24-f07f32cda37a,2020-06-08,The National,New museum opens in Business Bay,The framework introduced by UAE Central Bank is expected to modernize the tourism sector.,Jumeirah Group,Tourism,0.25,Neutral,English
9a99c6b8-3f45-43e0-85a2-ee1c1334e26a,2020-03-17,Khaleej Times,New IoT to reduce energy by 2%,"According to industry experts, the energy sector is experiencing market correction due to consumer demand.",Masdar,Energy,0.35,Positive,English
ada2bd60-4ab4-46e8-86cd-c6a688d6fccc,2022-04-23,Dubai Chronicle,Palm Jumeirah emerges as new hotspot for villa investments,"In a recent interview, Director stated that DP World will review policies in the coming months.",DP World,Real Estate,0.3,Neutral,English
ceda55bd-5370-4859-bebb-90f2b34d0a06,2023-01-28,Zawya,Dubai ranked leading in global tourism index,The policy introduced by Federal Authority is expected to modernize the tourism sector.,Expo 2020,Tourism,0.37,Positive,English
2d2e5e88-a1cf-43a9-8cba-066ea922f8a1,2022-03-11,Emirates 24/7,Dubai Tech sector grows by 27%,third-party reports show that investment has stabilized by 40% compared to last year.,G42,Tech,0.53,Positive,English
e01fc7a2-e1c0-4dbe-9779-9cd6dc583cd4,2024-05-10,Khaleej Times,New theme park opens in Downtown Dubai,government reports show that supply has increased by 7% compared to last year.,Dubai Tourism,Tourism,1.0,Positive,English
1285ed4f-569d-47d7-a36f-0c7f3e04517b,2020-04-01,Bloomberg MENA,.ﺕﺍﺭﺎﻘﻋ ﺔﻗﺎﻃ ﺔﺣﺎﻴﺳ ﺕﺍﺭﺎﻣﻻﺍ ﺔﻛﺮﺷ,.ﻉﻭﺮﺸﻣ ﻮﻤﻧ ﺎﻴﺟﻮﻟﻮﻨﻜﺗ ﺕﺍﺭﺎﻣﻻﺍ ﺔﻴﻟﺎﻣ ﺔﻗﺎﻃ,Dubai Islamic Bank,Finance,-0.01,Neutral,Arabic
f50527d3-a04b-45a7-b648-5632f1e6f3fd,2023-07-03,Zawya,platform launches in UAE with enhanced security,"According to industry experts, the tech sector is experiencing market correction due to consumer demand.",Souq.com,Tech,0.76,Positive,English
83ac593a-cf99-42e9-a133-3b22094ce061,2022-05-06,Arabian Business,Marriott announces expansion with 1 new properties,internal reports show that prices has decreased by 50% compared to last year.,Expo 2020,Tourism,0.76,Positive,English
b92038ca-6815-4697-b0b3-d000755d2abd,2022-08-22,Arab News,Dubai South reports steady performance in Q1 results,The regulation introduced by DIFC is expected to boost the real estate sector.,Dubai South,Real Estate,0.21,Neutral,English
2ba263c1-aeb9-4dcc-9bec-de99317c9cc1,2020-04-28,Bloomberg MENA,Dubai South reports steady performance in Q3 results,Dubai South has announced a major expansion in its latest move to regulate the market.,Dubai South,Real Estate,0.2,Neutral,English
ab67e9e3-19a7-4546-b048-84e98f98dbdc,2023-10-19,WAM (UAE News Agency),Dubai welcomes 8 million tourists in 2023,"According to industry experts, the tourism sector is experiencing market correction due to economic conditions.",Jumeirah Group,Tourism,0.75,Positive,English
c89ea79a-1b67-4cb0-b8b1-0e659dfb3050,2021-12-23,Dubai Chronicle,Palm Jumeirah emerges as new hotspot for penthouse investments,Dubai South has announced an innovative solution in its latest move to regulate the market.,Dubai South,Real Estate,0.78,Positive,English
4e1e2628-87e6-46c2-b158-71bff46418ec,2022-01-03,Khaleej Times,.ﺔﺣﺎﻴﺳ ﺔﻴﻟﺎﻣ ﺕﺍﺭﺎﻘﻋ ﻮﻤﻧ ﺭﻮﻄﺗ ﻲﺑﺩ ﺕﺍﺭﺎﻣﻻﺍ ﻕﻮﺳ ﺩﺎﺼﺘﻗﺍ,.ﻲﺑﺩ ﺔﻛﺮﺷ ﺎﻴﺟﻮﻟﻮﻨﻜﺗ ﻉﻭﺮﺸﻣ ﺕﺍﺭﺎﻘﻋ ﻕﻮﺳ,Masdar,Energy,0.58,Positive,Arabic
57787325-ac65-40dd-a8f0-9cfd4e8bf7e5,2022-01-15,Dubai Media Office,DP World announces new residential project in Downtown Dubai,"In a recent interview, Analyst stated that DP World will review policies in the coming months.",DP World,Real Estate,0.28,Neutral,English
ce515fd5-5b6d-4f9e-8f4e-3dbcc4981c41,2025-01-10,Khaleej Times,Dubai Islamic Bank reports steady performance in annual results,internal reports show that supply has fluctuated by 24% compared to last year.,Dubai Islamic Bank,Finance,0.39,Positive,English
a50c456e-b435-4bcb-b935-8b55f091d650,2021-11-23,LinkedIn Influencers,.ﺩﺎﺼﺘﻗﺍ ﻉﺎﻄﻗ ﻮﻤﻧ ﺔﻗﺎﻃ ﺎﻴﺟﻮﻟﻮﻨﻜﺗ ﻉﻭﺮﺸﻣ ﺕﺍﺭﺎﻘﻋ ﻕﻮﺳ ﺔﺣﺎﻴﺳ ﺔﻴﻟﺎﻣ,.ﺔﻛﺮﺷ ﻲﺑﺩ ﺩﺎﺼﺘﻗﺍ ﻉﻭﺮﺸﻣ ﺔﻴﻟﺎﻣ ﻉﺎﻄﻗ ﺕﺍﺭﺎﻘﻋ,G42,Tech,0.79,Positive,Arabic
83d13cf8-3c4e-4d40-95e5-d6024c45af58,2024-02-01,Dubai Chronicle,Dubai Islamic Bank reports mixed results in annual results,Dubai Islamic Bank has announced an innovative solution in its latest move to expand market share.,Dubai Islamic Bank,Finance,0.62,Positive,English
4dd47944-4e24-435f-bc18-babc38548c79,2022-01-08,The National,AED/stocks prices stabilize amid global trends,Dubai Islamic Bank has announced a major expansion in its latest move to boost growth.,Dubai Islamic Bank,Finance,0.44,Positive,English
e30c36cd-b993-4c84-ac0b-28ac9881ce33,2022-08-18,Facebook News Pages,Dubai Marina emerges as new hotspot for townhouse investments,The law introduced by Federal Authority is expected to transform the real estate sector.,Emaar,Real Estate,0.08,Neutral,English
96e357f6-ef80-4234-9965-58ae61b84b36,2021-06-11,The National,Marriott announces expansion with 10 new properties,third-party reports show that investment has increased by 48% compared to last year.,,Tourism,0.63,Positive,English
1db8cee7-f548-4990-b91f-6df8fb408e0b,2021-01-17,Emirates 24/7,.ﺔﻗﺎﻃ ﺔﻛﺮﺷ ﺕﺍﺭﺎﻘﻋ ﺔﻴﻟﺎﻣ ﺔﺣﺎﻴﺳ ﻉﺎﻄﻗ ﺎﻴﺟﻮﻟﻮﻨﻜﺗ ﻕﻮﺳ,.ﻮﻤﻧ ﻉﺎﻄﻗ ﻕﻮﺳ ﺭﺎﻤﺜﺘﺳﺍ ﺕﺍﺭﺎﻘﻋ ﺕﺍﺭﺎﻣﻻﺍ ﺔﻴﻟﺎﻣ,Emaar,Real Estate,0.38,Positive,Arabic
af649c29-1a16-4b0a-a40f-9fddcef7edd5,2022-08-27,Khaleej Times,Dubai announces new clean initiative,"In a recent interview, CEO stated that TAQA will invest in R&D in the coming months.",TAQA,Energy,0.49,Positive,English
345d9873-21c1-4333-adcc-03e7dca8c35b,2025-11-05,Khaleej Times,Emaar announces new residential project in Dubai Marina,The framework introduced by DIFC is expected to regulate the real estate sector.,Emaar,Real Estate,0.47,Positive,English
ac292af2-bf6e-48a3-b344-010f64d28068,2023-07-10,Zawya,New IoT initiative launched by AI Ministry,The policy introduced by UAE Central Bank is expected to boost the tech sector.,,,0.54,Positive,English
7039f13b-1ebb-43b3-968f-71fc49a0b93f,2024-10-12,Gulf News,Energy sector to invest $470 in digital transformation,DEWA has announced record profits in its latest move to improve sustainability.,DEWA,Energy,0.29,Neutral,English
9b2ce2ce-9395-4dd6-b83f-23a8a6c8c1cf,2022-11-12,Dubai Chronicle,New regulation to impact Real Estate sector,Dubai South has announced an innovative solution in its latest move to improve sustainability.,Dubai South,Real Estate,0.14,Neutral,English
9af445bb-99cb-43e5-8467-da6a52de9c9f,2022-01-07,Gulf News,BitOasis (Crypto) launches new platform for HNWIs,BitOasis (Crypto) has announced a major expansion in its latest move to boost growth.,BitOasis (Crypto),Finance,0.68,Positive,English
20656c88-ae5a-44f2-a1db-578192e0b00f,2021-10-15,Khaleej Times,Dubai penthouse prices stabilize by 2%,The framework introduced by UAE Central Bank is expected to restrict the real estate sector.,Dubai South,Real Estate,0.7,Positive,English
57d378a4-5eab-4b55-81ae-81c2f905ef95,2025-03-03,Dubai Media Office,Dubai townhouse prices surge by 15%,"In a recent interview, Analyst stated that Emaar will launch new products in the coming months.",,Real Estate,0.21,Neutral,English
0f878b4c-4c4b-4a2e-b83b-ebac5e19940e,2022-09-23,The National,New law to impact Real Estate sector,Nakheel has announced an innovative solution in its latest move to enhance services.,Nakheel,Real Estate,0.24,Neutral,English
d66f2be5-ca55-4aca-9af4-52356eb00372,2023-04-14,Arab News,.ﻉﻭﺮﺸﻣ ﻲﺑﺩ ﺭﻮﻄﺗ ﺕﺍﺭﺎﻘﻋ ﺕﺍﺭﺎﻣﻻﺍ ﻮﻤﻧ ﻕﻮﺳ,.ﻮﻤﻧ ﺔﺣﺎﻴﺳ ﺕﺍﺭﺎﻘﻋ ﺔﻗﺎﻃ ﺭﺎﻤﺜﺘﺳﺍ ﺕﺍﺭﺎﻣﻻﺍ ﺎﻴﺟﻮﻟﻮﻨﻜﺗ,Expo 2020,Tourism,0.58,Positive,Arabic
fee51bdc-24c3-4392-b85d-b57b02fc93ad,2021-04-13,Gulf News,.ﺔﻛﺮﺷ ﻮﻤﻧ ﺔﻴﻟﺎﻣ ﺔﻗﺎﻃ ﺭﺎﻤﺜﺘﺳﺍ ﺕﺍﺭﺎﻘﻋ ﺕﺍﺭﺎﻣﻻﺍ,.ﺔﻛﺮﺷ ﺭﻮﻄﺗ ﺔﻗﺎﻃ ﺎﻴﺟﻮﻟﻮﻨﻜﺗ ﻉﺎﻄﻗ,BitOasis (Crypto),Finance,0.42,Positive,Arabic
