Article_ID,Date,Source,Title,Content_Snippet,Entity_Mentioned,Sector,Sentiment_Score,Sentiment_Label,Language
0b6cb673-9c98-485a-ba7f-9cf8816226ac,2024-02-03,Arabian Business,G42 raises $399 in seed funding,"In a recent interview, CEO stated that G42 will expand operations in the coming months.",,Tech,0.68,Positive,English
5715755f-f9fb-45ad-855b-05d70ccf78d2,2023-09-02,Zawya,.ﻮﻤﻧ ﺔﻴﻟﺎﻣ ﺕﺍﺭﺎﻣﻻﺍ ﺎﻴﺟﻮﻟﻮﻨﻜﺗ ﻉﻭﺮﺸﻣ ﺔﻛﺮﺷ ﺩﺎﺼﺘﻗﺍ,.ﺔﺣﺎﻴﺳ ﺕﺍﺭﺎﻣﻻﺍ ﺎﻴﺟﻮﻟﻮﻨﻜﺗ ﺕﺍﺭﺎﻘﻋ ﻲﺑﺩ ﺔﻗﺎﻃ ﻉﻭﺮﺸﻣ ﺭﺎﻤﺜﺘﺳﺍ,Nakheel,Real Estate,0.43,Positive,Arabic
ffb692b0-3bb3-4981-9282-9cc8b5caa04b,2025-08-05,Zawya,market conditions drives transformation to tourism sector,"According to industry experts, the tourism sector is experiencing a slowdown due to economic conditions.",Dubai Tourism,Tourism,0.69,Positive,English
834bd104-e119-4cd8-9826-ffdd6178c673,2024-05-10,Dubai Chronicle,.ﺭﺎﻤﺜﺘﺳﺍ ﻮﻤﻧ ﺎﻴﺟﻮﻟﻮﻨﻜﺗ ﻕﻮﺳ ﺩﺎﺼﺘﻗﺍ,.ﻲﺑﺩ ﺔﻗﺎﻃ ﺭﻮﻄﺗ ﺎﻴﺟﻮﻟﻮﻨﻜﺗ ﺔﺣﺎﻴﺳ ﻉﻭﺮﺸﻣ ﻉﺎﻄﻗ ﺔﻛﺮﺷ,AI Ministry,Tech,0.94,Positive,Arabic
2917a020-7c10-4c3a-b101-fcaae48b2e55,2025-03-30,Emirates 24/7,.ﺎﻴﺟﻮﻟﻮﻨﻜﺗ ﺔﻗﺎﻃ ﺔﻴﻟﺎﻣ ﺕﺍﺭﺎﻘﻋ ﻲﺑﺩ ﺔﻛﺮﺷ ﺔﺣﺎﻴﺳ ﻮﻤﻧ ﻉﻭﺮﺸﻣ,.ﻉﺎﻄﻗ ﺔﻴﻟﺎﻣ ﺔﻛﺮﺷ ﻉﻭﺮﺸﻣ ﻕﻮﺳ ﺭﻮﻄﺗ ﺕﺍﺭﺎﻘﻋ ﺔﺣﺎﻴﺳ,TAQA,Energy,0.33,Neutral,Arabic
0bbf1c21-9873-434b-b9a8-367bd6eb28df,2023-04-09,Dubai Chronicle,Palm Jumeirah emerges as new hotspot for villa investments,"According to industry experts, the real estate sector is experiencing a slowdown due to technological advancements.",Dubai South,Real Estate,0.32,Neutral,English
d3b9c40d-ccaf-46ff-a1b7-b4317c309c8b,2022-09-16,Emirates 24/7,Rotana announces expansion with 5 new properties,Expo 2020 has announced a strategic partnership in its latest move to boost growth.,Expo 2020,Tourism,0.53,Positive,English
ef38cf10-d59f-4081-a98e-d5c0a49a8525,2022-02-06,Emirates 24/7,New regulation to impact Real Estate sector,Nakheel has announced a strategic partnership in its latest move to improve sustainability.,Nakheel,Real Estate,0.36,Positive,English
5e2df623-63d2-4614-bf0c-eaba852caf88,2021-01-29,WAM (UAE News Agency),.ﺕﺍﺭﺎﻘﻋ ﺕﺍﺭﺎﻣﻻﺍ ﻉﻭﺮﺸﻣ ﺭﻮﻄﺗ ﻲﺑﺩ ﺭﺎﻤﺜﺘﺳﺍ ﺔﻗﺎﻃ ﻉﺎﻄﻗ,.ﺔﻗﺎﻃ ﺔﻛﺮﺷ ﻉﻭﺮﺸﻣ ﺔﻴﻟﺎﻣ ﺎﻴﺟﻮﻟﻮﻨﻜﺗ ﺭﻮﻄﺗ ﻲﺑﺩ ﺔﺣﺎﻴﺳ ﻉﺎﻄﻗ ﻕﻮﺳ,Careem,Tech,0.48,Positive,Arabic
c4d28c59-f74c-452a-978f-62f555bb4f7e,2021-03-28,Gulf News,G42 raises $118 in Series B funding,G42 has announced an innovative solution in its latest move to expand market share.,G42,Tech,0.72,Positive,English
e57f1ec4-89fc-46c0-80e1-0f1fcd676e61,2022-10-15,Gulf News,platform launches in UAE with enhanced security,third-party reports show that investment has fluctuated by 39% compared to last year.,Souq.com,Tech,0.48,Positive,English
62b50ee7-d17e-4836-8574-b7929cda99c6,2020-01-09,Bloomberg MENA,New law to impact Real Estate sector,"In a recent interview, Analyst stated that Emaar will invest in R&D in the coming months.",Emaar,Real Estate,0.3,Neutral,English
517455bd-bd70-40e8-a681-01ee7c931f7d,2024-08-24,Emirates 24/7,Careem raises $387 in seed funding,"In a recent interview, Director stated that Careem will review policies in the coming months.",Careem,Tech,0.47,Positive,English
4f188428-bfe4-48b3-86cc-a594619febe7,2024-06-24,WAM (UAE News Agency),BitOasis (Crypto) announces update to banking,"According to industry experts, the finance sector is experiencing unprecedented demand due to global trends.",BitOasis (Crypto),Finance,0.88,Positive,English
cf227ab4-1a56-438c-af9c-949a3cbe62ea,2024-06-14,Arab News,Dubai townhouse prices drop by 18%,industry reports show that prices has stabilized by 19% compared to last year.,Nakheel,Real Estate,0.47,Positive,English
40f547d2-1e84-4cc4-95ec-4323837a3158,2020-06-08,Dubai Chronicle,Dubai Tech sector grows by 12%,"According to industry experts, the tech sector is experiencing market correction due to consumer demand.",G42,Tech,0.09,Neutral,English
48b74da6-45b9-47a5-bb7a-2fa850622519,2020-09-02,Zawya,platform launches in UAE with Arabic support,industry reports show that demand has stabilized by 8% compared to last year.,AI Ministry,Tech,0.69,Positive,English
7acda0b7-d0ee-45b4-ad9a-c143c3035c5d,2025-09-13,Arab News,Dubai Tech sector grows by 28%,"In a recent interview, CEO stated that Careem will invest in R&D in the coming months.",Careem,Tech,0.67,Positive,English
6104cbf4-1aad-4f71-8067-9bb2030f8061,2025-04-07,Arabian Business,.ﺩﺎﺼﺘﻗﺍ ﺔﻴﻟﺎﻣ ﺔﻛﺮﺷ ﻕﻮﺳ ﻮﻤﻧ ﺕﺍﺭﺎﻣﻻﺍ ﺕﺍﺭﺎﻘﻋ ﺭﻮﻄﺗ,.ﺭﻮﻄﺗ ﺔﻗﺎﻃ ﺎﻴﺟﻮﻟﻮﻨﻜﺗ ﺩﺎﺼﺘﻗﺍ ﺔﺣﺎﻴﺳ ﺔﻴﻟﺎﻣ ﻲﺑﺩ ﻉﺎﻄﻗ,Careem,Tech,0.63,Positive,Arabic
b6b81eab-d8a3-491a-b753-1edcca40056e,2024-12-03,The National,New law to impact Real Estate sector,Nakheel has announced an innovative solution in its latest move to improve sustainability.,Nakheel,Real Estate,0.29,Neutral,English
11059737-9b31-4915-97b9-878ce046b1ce,2024-06-18,Twitter Threads,.ﺕﺍﺭﺎﻘﻋ ﺔﺣﺎﻴﺳ ﻮﻤﻧ ﻲﺑﺩ ﺭﻮﻄﺗ ﺔﻛﺮﺷ ﺕﺍﺭﺎﻣﻻﺍ,.ﻮﻤﻧ ﺭﺎﻤﺜﺘﺳﺍ ﻉﺎﻄﻗ ﺔﻴﻟﺎﻣ ﻲﺑﺩ,Mashreq Bank,Finance,0.7,Positive,Arabic
ee4566cb-9233-4aee-9e5c-a804435de647,2020-07-08,Twitter Threads,New IoT initiative launched by G42,"In a recent interview, Analyst stated that G42 will invest in R&D in the coming months.",G42,Tech,0.77,Positive,English
72e2d00e-100a-41e5-afbd-427123e2695a,2025-05-12,Dubai Chronicle,G42 raises $125 in seed funding,The regulation introduced by UAE Central Bank is expected to modernize the tech sector.,G42,Tech,0.65,Positive,English
c32e09e0-65ca-4a60-904c-d22dee549709,2020-11-22,Khaleej Times,BitOasis (Crypto) reports significant decline in annual results,BitOasis (Crypto) has announced an innovative solution in its latest move to regulate the market.,,,0.52,Positive,English
d1684d18-787d-42be-933b-7acf761adb1d,2024-03-18,The National,Nakheel reports strong growth in Q1 results,"In a recent interview, CEO stated that Nakheel will expand operations in the coming months.",Nakheel,Real Estate,0.34,Positive,English
c30e148b-9211-484d-a75d-00cb16b32d75,2025-05-17,Gulf News,New policy to impact Real Estate sector,"According to industry experts, the real estate sector is experiencing strong performance due to economic conditions.",DP World,Real Estate,0.17,Neutral,English
5b081057-7c1b-44a7-81b7-77e5488c6c5d,2022-06-09,Dubai Chronicle,G42 partners with international firm for digital transformation,G42 has announced new regulations in its latest move to regulate the market.,G42,Tech,0.42,Positive,English
4d608e53-fa0e-4a76-b030-e1107533b38b,2023-08-27,Dubai Media Office,New theme park opens in Downtown Dubai,government reports show that prices has increased by 33% compared to last year.,Jumeirah Group,Tourism,0.54,Positive,English
f355b6d0-a5de-4f99-8991-9e13c7440526,2021-08-17,WAM (UAE News Agency),.ﺭﻮﻄﺗ ﻕﻮﺳ ﻲﺑﺩ ﺕﺍﺭﺎﻣﻻﺍ ﺕﺍﺭﺎﻘﻋ ﺔﻴﻟﺎﻣ,.ﻕﻮﺳ ﺔﻛﺮﺷ ﺔﻗﺎﻃ ﺭﺎﻤﺜﺘﺳﺍ ﻮﻤﻧ ﻉﻭﺮﺸﻣ ﺕﺍﺭﺎﻘﻋ ﻉﺎﻄﻗ ﺔﻴﻟﺎﻣ ﺔﺣﺎﻴﺳ,Nakheel,Real Estate,0.33,Neutral,Arabic
c882d5e9-aef2-4739-82fc-0d0659a3d8b4,2021-05-31,Zawya,New law to impact Real Estate sector,government reports show that supply has decreased by 28% compared to last year.,Emaar,Real Estate,0.4,Positive,English
a4f0d70d-3df5-49fa-9b66-3795d0d7b5d3,2024-01-23,Dubai Chronicle,Energy sector to invest $387 in smart city,"In a recent interview, Spokesperson stated that TAQA will invest in R&D in the coming months.",TAQA,Energy,0.52,Positive,English
c3747b10-c36f-4d17-bf2d-5bfd4dd26b6b,2025-11-04,WAM (UAE News Agency),.ﺔﻛﺮﺷ ﻉﻭﺮﺸﻣ ﺔﻴﻟﺎﻣ ﺔﻗﺎﻃ ﺩﺎﺼﺘﻗﺍ ﻮﻤﻧ ﻲﺑﺩ ﺔﺣﺎﻴﺳ,.ﺔﻴﻟﺎﻣ ﺔﻗﺎﻃ ﺭﻮﻄﺗ ﺭﺎﻤﺜﺘﺳﺍ ﺔﺣﺎﻴﺳ ﺔﻛﺮﺷ ﺎﻴﺟﻮﻟﻮﻨﻜﺗ,Dubai South,Real Estate,0.24,Neutral,Arabic
13e18114-d7dc-479a-ad24-af2b131ce3ca,2022-03-29,LinkedIn Influencers,Dubai Finance sector sees surge in revenue,The law introduced by Dubai Government is expected to transform the finance sector.,DIFC,Finance,0.46,Positive,English
6d294a3c-3b71-4b04-bfac-f61605574edd,2020-05-13,Arabian Business,Dubai apartment prices surge by 26%,The policy introduced by UAE Central Bank is expected to regulate the real estate sector.,Dubai South,Real Estate,0.03,Neutral,English
071c4b18-5c9d-414c-bdd9-b04f4cf1f4bc,2021-11-06,The National,New shopping complex opens in Palm Jumeirah,Jumeirah Group has announced a strategic partnership in its latest move to boost growth.,Jumeirah Group,Tourism,1.0,Positive,English
a85b941b-1f45-4c2d-aff8-86b0f390f48f,2024-09-26,The National,.ﻕﻮﺳ ﺔﻴﻟﺎﻣ ﺕﺍﺭﺎﻘﻋ ﻉﺎﻄﻗ ﻮﻤﻧ,.ﻲﺑﺩ ﺎﻴﺟﻮﻟﻮﻨﻜﺗ ﺩﺎﺼﺘﻗﺍ ﺭﻮﻄﺗ ﻕﻮﺳ ﻉﺎﻄﻗ ﺭﺎﻤﺜﺘﺳﺍ ﻮﻤﻧ,Souq.com,Tech,0.42,Positive,Arabic
c8f2ae45-9241-4bcf-bd5a-4b3cd7616766,2020-04-20,Khaleej Times,.ﻲﺑﺩ ﺔﺣﺎﻴﺳ ﺩﺎﺼﺘﻗﺍ ﻉﻭﺮﺸﻣ ﺕﺍﺭﺎﻘﻋ,.ﺕﺍﺭﺎﻘﻋ ﻉﻭﺮﺸﻣ ﺕﺍﺭﺎﻣﻻﺍ ﻮﻤﻧ ﺔﻴﻟﺎﻣ ﺔﻛﺮﺷ,,Tourism,0.27,Neutral,Arabic
4e9e75fc-86b9-4291-9d4b-59a83ef6a30a,2024-07-09,Dubai Chronicle,Dubai announces new renewable initiative,third-party reports show that supply has decreased by 18% compared to last year.,DEWA,Energy,0.45,Positive,English
a123142f-b137-4baa-b80b-f7724a0bb98e,2021-03-28,Arab News,.ﺕﺍﺭﺎﻘﻋ ﻕﻮﺳ ﺔﻗﺎﻃ ﺔﻛﺮﺷ ﻲﺑﺩ ﺔﺣﺎﻴﺳ ﺕﺍﺭﺎﻣﻻﺍ,.ﺭﺎﻤﺜﺘﺳﺍ ﺭﻮﻄﺗ ﺩﺎﺼﺘﻗﺍ ﺔﻗﺎﻃ ﻉﻭﺮﺸﻣ ﺔﺣﺎﻴﺳ ﺕﺍﺭﺎﻘﻋ ﺕﺍﺭﺎﻣﻻﺍ,Nakheel,Real Estate,0.19,Neutral,Arabic
c93a5dc3-bd43-44ae-b735-77f633766c07,2021-03-30,Zawya,Dubai penthouse prices drop by 2%,"In a recent interview, Director stated that Emaar will expand operations in the coming months.",Emaar,Real Estate,0.18,Neutral,English
85195f93-fd2c-480f-8336-eceaa629de7e,2025-10-29,Facebook News Pages,.ﺔﻗﺎﻃ ﻲﺑﺩ ﺩﺎﺼﺘﻗﺍ ﻕﻮﺳ ﺎﻴﺟﻮﻟﻮﻨﻜﺗ,.ﻲﺑﺩ ﺔﻗﺎﻃ ﺕﺍﺭﺎﻣﻻﺍ ﺭﻮﻄﺗ ﺎﻴﺟﻮﻟﻮﻨﻜﺗ ﺩﺎﺼﺘﻗﺍ ﺔﺣﺎﻴﺳ ﻕﻮﺳ ﻉﻭﺮﺸﻣ ﻮﻤﻧ,AI Ministry,Tech,0.53,Positive,Arabic
fdc2ddf9-04f8-4f31-b3bc-0aee25b15efd,2024-01-18,Khaleej Times,Hilton announces expansion with 18 new properties,The policy introduced by Federal Authority is expected to transform the tourism sector.,Expo 2020,Tourism,0.76,Positive,English
0a983f40-a65f-4fa2-b76a-e09074b58083,2025-09-29,Twitter Threads,Dubai ranked most improved in global tourism index,"In a recent interview, Analyst stated that Dubai Tourism will review policies in the coming months.",Dubai Tourism,Tourism,0.5,Positive,English
566184fc-c94e-4dd1-a26f-d2a8e945890c,2020-07-08,Khaleej Times,Dubai South reports significant decline in Q4 results,"In a recent interview, Analyst stated that Dubai South will launch new products in the coming months.",Dubai South,Real Estate,0.15,Neutral,English
0fbd4d06-1956-42eb-b23e-04617677f3a0,2024-09-20,Khaleej Times,DEWA signs MoU with local startup for innovation hub,"According to industry experts, the energy sector is experiencing rapid growth due to consumer demand.",DEWA,Energy,0.26,Neutral,English
5360d846-a950-40bb-a65b-0ca0c267b47c,2024-08-06,Arabian Business,Emaar announces new residential project in Dubai Marina,government reports show that supply has fluctuated by 37% compared to last year.,Emaar,Real Estate,0.21,Neutral,English
7778b27c-dec7-459e-98b4-ca0db2d6a6aa,2022-03-01,Facebook News Pages,AI Ministry partners with international firm for digital transformation,AI Ministry has announced an innovative solution in its latest move to boost growth.,AI Ministry,Tech,0.67,Positive,English
5396016c-ccc2-4c12-96de-f2e8b833d078,2024-08-28,Dubai Media Office,Dubai Finance sector sees fluctuate in output,BitOasis (Crypto) has announced a major expansion in its latest move to regulate the market.,BitOasis (Crypto),Finance,0.34,Positive,English
d4bfda52-c502-431b-96e4-c1947038d7ca,2021-05-24,Emirates 24/7,.ﺕﺍﺭﺎﻣﻻﺍ ﺭﺎﻤﺜﺘﺳﺍ ﺕﺍﺭﺎﻘﻋ ﻉﻭﺮﺸﻣ ﻮﻤﻧ ﺎﻴﺟﻮﻟﻮﻨﻜﺗ ﻉﺎﻄﻗ,.ﺔﺣﺎﻴﺳ ﺕﺍﺭﺎﻣﻻﺍ ﺔﻴﻟﺎﻣ ﺕﺍﺭﺎﻘﻋ ﺭﺎﻤﺜﺘﺳﺍ ﻲﺑﺩ ﺩﺎﺼﺘﻗﺍ ﺔﻛﺮﺷ,BitOasis (Crypto),Finance,0.44,Positive,Arabic
72d92a50-10a4-4a7c-acad-a862e57bc8f3,2023-08-19,Arab News,Emaar reports significant decline in Q1 results,"In a recent interview, Minister stated that Emaar will expand operations in the coming months.",Emaar,Real Estate,0.12,Neutral,English
0941f155-8125-4006-938a-0e798ad8f546,2022-10-12,WAM (UAE News Agency),Business Bay emerges as new hotspot for penthouse investments,internal reports show that supply has fluctuated by 15% compared to last year.,Emaar,Real Estate,0.35,Positive,English
f914a911-ea42-4088-89e3-13c9f8092a02,2024-04-30,Arabian Business,Dubai apartment prices fluctuate by 4%,The policy introduced by DIFC is expected to regulate the real estate sector.,DP World,Real Estate,0.95,Positive,English
b76319f5-592a-46c7-a7af-25ad1912d3c5,2022-09-11,The National,Masdar signs MoU with international firm for innovation hub,"In a recent interview, Minister stated that Masdar will review policies in the coming months.",Masdar,Energy,0.11,Neutral,English
7303765b-17d1-417d-bfd9-8a17fd1c6753,2023-06-20,Dubai Media Office,Dubai ranked top in global tourism index,The framework introduced by UAE Central Bank is expected to transform the tourism sector.,Dubai Tourism,Tourism,0.7,Positive,English
3153c3d7-ee8f-4d0f-aae6-42882e82c419,2021-10-23,LinkedIn Influencers,Dubai ranked most improved in global tourism index,Jumeirah Group has announced new regulations in its latest move to regulate the market.,Jumeirah Group,Tourism,1.0,Positive,English
43c50585-edc1-4f58-9bfe-dfddba874841,2022-07-01,Gulf News,Dubai announces new solar initiative,"In a recent interview, Director stated that Masdar will review policies in the coming months.",Masdar,Energy,0.41,Positive,English
23b9aab0-0646-4e4a-8175-1b8998fd4692,2024-08-15,LinkedIn Influencers,Mashreq Bank reports record results in annual results,"In a recent interview, Analyst stated that Mashreq Bank will expand operations in the coming months.",Mashreq Bank,Finance,0.7,Positive,English
fe914093-2b80-4e40-90d3-05ddf921b7f2,2020-11-17,Facebook News Pages,.ﺔﺣﺎﻴﺳ ﻲﺑﺩ ﺭﺎﻤﺜﺘﺳﺍ ﻮﻤﻧ ﺭﻮﻄﺗ,.ﺔﻗﺎﻃ ﺔﻴﻟﺎﻣ ﺕﺍﺭﺎﻣﻻﺍ ﺎﻴﺟﻮﻟﻮﻨﻜﺗ ﻲﺑﺩ ﺕﺍﺭﺎﻘﻋ ﻉﻭﺮﺸﻣ ﺔﻛﺮﺷ ﻉﺎﻄﻗ ﺭﻮﻄﺗ,Masdar,Energy,0.46,Positive,Arabic
6718f7bc-46b9-4db8-98ca-ef87603e7508,2021-08-05,Khaleej Times,Jumeirah announces expansion with 3 new properties,industry reports show that investment has increased by 7% compared to last year.,Dubai Tourism,Tourism,0.51,Positive,English
7d756d4a-4076-4eed-a06a-6f68cd9c849f,2020-02-26,Gulf News,Dubai announces new clean initiative,The regulation introduced by Federal Authority is expected to restrict the energy sector.,,Energy,0.38,Positive,English
bc60dbd4-b381-4b76-ae44-1faf63cefc31,2024-07-17,Arab News,.ﺩﺎﺼﺘﻗﺍ ﺕﺍﺭﺎﻘﻋ ﻲﺑﺩ ﺔﻛﺮﺷ ﺔﻗﺎﻃ ﺔﺣﺎﻴﺳ ﺕﺍﺭﺎﻣﻻﺍ ﻉﻭﺮﺸﻣ,.ﻕﻮﺳ ﻲﺑﺩ ﺕﺍﺭﺎﻘﻋ ﻮﻤﻧ ﺩﺎﺼﺘﻗﺍ,G42,Tech,0.74,Positive,Arabic
075107ed-2679-44b1-ba93-fd89b30db468,2023-01-28,LinkedIn Influencers,Masdar signs MoU with government for digital transformation,"According to industry experts, the energy sector is experiencing unprecedented demand due to government policies.",Masdar,Energy,0.27,Neutral,English
da7c5e52-099c-49b6-9a15-61460981ee4e,2022-09-25,Gulf News,New shopping complex opens in Downtown Dubai,The law introduced by DIFC is expected to boost the tourism sector.,Expo 2020,Tourism,1.0,Positive,English
e87fdc38-6ae0-4595-9d71-18752323beb5,2021-03-26,Bloomberg MENA,New museum opens in Palm Jumeirah,internal reports show that demand has increased by 32% compared to last year.,Dubai Tourism,Tourism,0.83,Positive,English
30d0c0b1-4336-4cfc-901f-7436340c294c,2023-08-24,Arab News,Nakheel reports mixed results in Q1 results,government reports show that demand has decreased by 20% compared to last year.,Nakheel,Real Estate,0.16,Neutral,English
06f22a6e-c2f3-4214-8f8a-a554c998b230,2022-09-20,Gulf News,New law to impact Real Estate sector,Emaar has announced an innovative solution in its latest move to boost growth.,Emaar,Real Estate,0.44,Positive,English
06c63793-e698-42ef-999f-8780c0430924,2022-09-16,Emirates 24/7,New shopping complex opens in Business Bay,"According to industry experts, the tourism sector is experiencing a slowdown due to consumer demand.",Dubai Tourism,Tourism,0.93,Positive,English
e31cd9b4-d4fd-403a-87ec-a3bdc9660892,2023-05-27,Khaleej Times,Souq.com raises $435 in Series A funding,third-party reports show that demand has stabilized by 22% compared to last year.,Souq.com,Tech,0.8,Positive,English
21547829-3225-4ad8-9837-daf29d5951d0,2021-09-30,Emirates 24/7,.ﺎﻴﺟﻮﻟﻮﻨﻜﺗ ﻲﺑﺩ ﺔﻴﻟﺎﻣ ﺭﺎﻤﺜﺘﺳﺍ ﻕﻮﺳ ﺔﺣﺎﻴﺳ ﻮﻤﻧ ﻉﻭﺮﺸﻣ,.ﺕﺍﺭﺎﻣﻻﺍ ﻕﻮﺳ ﺭﻮﻄﺗ ﺔﻴﻟﺎﻣ ﺔﻛﺮﺷ ﺩﺎﺼﺘﻗﺍ ﺎﻴﺟﻮﻟﻮﻨﻜﺗ ﺔﺣﺎﻴﺳ ﻲﺑﺩ,BitOasis (Crypto),Finance,0.53,Positive,Arabic
ae057564-2fe5-4e07-9381-8d7c2512ffa1,2023-05-31,Arabian Business,.ﺔﻗﺎﻃ ﺔﺣﺎﻴﺳ ﻮﻤﻧ ﻕﻮﺳ ﺔﻴﻟﺎﻣ ﺭﺎﻤﺜﺘﺳﺍ ﻲﺑﺩ ﻉﺎﻄﻗ ﺎﻴﺟﻮﻟﻮﻨﻜﺗ ﺕﺍﺭﺎﻣﻻﺍ,.ﻕﻮﺳ ﻮﻤﻧ ﻲﺑﺩ ﺔﻗﺎﻃ ﺕﺍﺭﺎﻘﻋ ﻉﻭﺮﺸﻣ,Jumeirah Group,Tourism,0.83,Positive,Arabic
551f79fa-1e5d-4358-9b53-5a1821b0b574,2024-09-15,The National,SAR/crypto prices surge amid global trends,The law introduced by UAE Central Bank is expected to transform the finance sector.,DIFC,Finance,0.66,Positive,English
eaf6d0da-6514-4bfb-9633-bbd8bc40b05b,2024-02-19,Dubai Chronicle,G42 partners with international firm for digital transformation,G42 has announced a major expansion in its latest move to regulate the market.,G42,Tech,0.74,Positive,English
20b10665-7415-4bc7-9684-2b37bf8dd689,2023-05-01,Arabian Business,New law to impact Real Estate sector,The regulation introduced by Dubai Government is expected to modernize the real estate sector.,Emaar,Real Estate,0.41,Positive,English
ebc906c9-8780-4db9-bb76-3f51ca51610c,2023-12-28,Emirates 24/7,Dubai announces new clean initiative,"In a recent interview, Minister stated that TAQA will hire more staff in the coming months.",TAQA,Energy,0.44,Positive,English
6c3a00d9-4a6c-4dab-8d8a-50b28bf67f2b,2021-06-19,Emirates 24/7,Dubai penthouse prices surge by 25%,"In a recent interview, Spokesperson stated that Dubai South will invest in R&D in the coming months.",Dubai South,Real Estate,0.45,Positive,English
73ad3e82-edb3-40ac-a613-e5352ee4e298,2021-01-06,Dubai Chronicle,DIFC announces revision to banking,The framework introduced by DIFC is expected to modernize the finance sector.,DIFC,Finance,0.47,Positive,English
081e1fbd-585c-4d32-a9fe-8cad8c6a395e,2025-06-14,Emirates 24/7,DIFC reports record results in annual results,industry reports show that growth has stabilized by 35% compared to last year.,DIFC,Finance,0.6,Positive,English
b3a2b0c7-4a87-4575-ab28-36efaa362fa0,2021-03-25,Emirates 24/7,.ﻮﻤﻧ ﻲﺑﺩ ﺎﻴﺟﻮﻟﻮﻨﻜﺗ ﺕﺍﺭﺎﻣﻻﺍ ﺔﺣﺎﻴﺳ ﺔﻛﺮﺷ ﻕﻮﺳ ﺭﺎﻤﺜﺘﺳﺍ ﺩﺎﺼﺘﻗﺍ,.ﻕﻮﺳ ﺔﻛﺮﺷ ﺩﺎﺼﺘﻗﺍ ﻉﺎﻄﻗ ﻮﻤﻧ ﺔﺣﺎﻴﺳ ﺭﻮﻄﺗ ﻲﺑﺩ ﺔﻗﺎﻃ,Dubai South,Real Estate,0.34,Positive,Arabic
c546d115-3d57-4146-9dcb-04e07c1cd673,2022-09-01,Khaleej Times,Careem partners with local startup for innovation hub,The law introduced by UAE Central Bank is expected to modernize the tech sector.,Careem,Tech,0.63,Positive,English
3b3549c5-47ad-432c-8266-f0879ecb1103,2021-11-22,Dubai Chronicle,DEWA signs MoU with international firm for smart city,"In a recent interview, Spokesperson stated that DEWA will expand operations in the coming months.",DEWA,Energy,0.44,Positive,English
00d89bab-412f-46c3-bef9-ad2b6bf29b95,2024-01-08,Twitter Threads,.ﺔﺣﺎﻴﺳ ﺕﺍﺭﺎﻣﻻﺍ ﻲﺑﺩ ﺎﻴﺟﻮﻟﻮﻨﻜﺗ ﺔﻴﻟﺎﻣ ﻉﻭﺮﺸﻣ ﺭﻮﻄﺗ ﺩﺎﺼﺘﻗﺍ ﻉﺎﻄﻗ ﺔﻛﺮﺷ,.ﺕﺍﺭﺎﻣﻻﺍ ﻉﺎﻄﻗ ﻉﻭﺮﺸﻣ ﺭﺎﻤﺜﺘﺳﺍ ﺩﺎﺼﺘﻗﺍ ﻕﻮﺳ ﺔﻛﺮﺷ ﻮﻤﻧ ﺎﻴﺟﻮﻟﻮﻨﻜﺗ,,,0.57,Positive,Arabic
f1c2591e-54aa-4eb2-a52d-a2f07713ec45,2022-07-01,Emirates 24/7,G42 raises $372 in Series B funding,government reports show that growth has stabilized by 31% compared to last year.,G42,Tech,0.47,Positive,English
6c9ddba8-e68b-495c-9dd3-0ea822b5f831,2023-05-08,Khaleej Times,Emaar reports strong growth in Q4 results,"In a recent interview, Analyst stated that Emaar will launch new products in the coming months.",Emaar,Real Estate,0.49,Positive,English
a9f98c0c-9418-45fe-aaf3-de9bb9010b73,2024-07-13,Khaleej Times,Emaar reports significant decline in Q4 results,"According to industry experts, the real estate sector is experiencing market correction due to global trends.",Emaar,Real Estate,0.36,Positive,English
c14cdc17-f19a-4838-8d8c-c278dc04d03b,2020-04-09,Gulf News,.ﻉﻭﺮﺸﻣ ﻕﻮﺳ ﺭﻮﻄﺗ ﻉﺎﻄﻗ ﺔﻴﻟﺎﻣ ﻮﻤﻧ ﺩﺎﺼﺘﻗﺍ ﺕﺍﺭﺎﻘﻋ ﻲﺑﺩ,.ﻉﻭﺮﺸﻣ ﺕﺍﺭﺎﻣﻻﺍ ﺎﻴﺟﻮﻟﻮﻨﻜﺗ ﺕﺍﺭﺎﻘﻋ ﻮﻤﻧ ﺔﻛﺮﺷ ﻕﻮﺳ ﺭﺎﻤﺜﺘﺳﺍ,Souq.com,Tech,0.32,Neutral,Arabic
a1ba9ab8-ca50-4678-b974-c31338ddbb6c,2023-12-20,Gulf News,TAQA signs MoU with local startup for innovation hub,The policy introduced by DIFC is expected to modernize the energy sector.,TAQA,Energy,0.47,Positive,English
6b07f70c-9dd5-4bd9-a1ac-b20f5d76baa8,2020-05-05,Dubai Chronicle,Dubai ranked top in global tourism index,"According to industry experts, the tourism sector is experiencing unprecedented demand due to consumer demand.",Dubai Tourism,Tourism,0.15,Neutral,English
285db0a1-0fc5-436e-96c6-cc8f69f178f6,2025-03-28,Bloomberg MENA,SAR/bonds prices stabilize amid global trends,"According to industry experts, the finance sector is experiencing rapid growth due to global trends.",DIFC,Finance,0.4,Positive,English
d52df02a-62d9-45ef-92e7-829f4bbfa2b0,2021-06-15,Arab News,DP World announces new mega project in Dubai Marina,DP World has announced new regulations in its latest move to regulate the market.,DP World,Real Estate,0.39,Positive,English
b218a3ff-5560-4bad-a5b1-6c0ff6dffa4f,2020-04-26,Zawya,.ﺭﺎﻤﺜﺘﺳﺍ ﺭﻮﻄﺗ ﺔﺣﺎﻴﺳ ﻮﻤﻧ ﺎﻴﺟﻮﻟﻮﻨﻜﺗ ﻲﺑﺩ,.ﻮﻤﻧ ﺔﻴﻟﺎﻣ ﺭﺎﻤﺜﺘﺳﺍ ﺔﺣﺎﻴﺳ ﺕﺍﺭﺎﻣﻻﺍ ﺎﻴﺟﻮﻟﻮﻨﻜﺗ ﺔﻛﺮﺷ ﻉﻭﺮﺸﻣ ﺔﻗﺎﻃ ﻉﺎﻄﻗ,Emaar,Real Estate,-0.05,Neutral,Arabic
f1642dc2-3bea-4c9b-ba44-d7a291466226,2025-02-09,Arabian Business,DIFC reports mixed results in annual results,The regulation introduced by DIFC is expected to regulate the finance sector.,DIFC,Finance,0.69,Positive,English
7ac4bdcf-d583-41c5-a239-21ac92579308,2024-04-19,Khaleej Times,.ﻉﻭﺮﺸﻣ ﺔﻴﻟﺎﻣ ﺕﺍﺭﺎﻘﻋ ﺭﺎﻤﺜﺘﺳﺍ ﻉﺎﻄﻗ,.ﻉﺎﻄﻗ ﻕﻮﺳ ﺎﻴﺟﻮﻟﻮﻨﻜﺗ ﺭﻮﻄﺗ ﻉﻭﺮﺸﻣ,Masdar,Energy,0.79,Positive,Arabic
ddeb4112-48bf-4f52-b5bd-5dc97476a655,2024-01-31,Bloomberg MENA,.ﻮﻤﻧ ﺩﺎﺼﺘﻗﺍ ﺎﻴﺟﻮﻟﻮﻨﻜﺗ ﻕﻮﺳ ﻉﺎﻄﻗ ﺔﻗﺎﻃ ﻉﻭﺮﺸﻣ,.ﺎﻴﺟﻮﻟﻮﻨﻜﺗ ﻉﺎﻄﻗ ﺕﺍﺭﺎﻣﻻﺍ ﻮﻤﻧ ﺕﺍﺭﺎﻘﻋ ﺔﺣﺎﻴﺳ ﺩﺎﺼﺘﻗﺍ ﺭﺎﻤﺜﺘﺳﺍ ﺔﻴﻟﺎﻣ ﺔﻛﺮﺷ,DEWA,Energy,0.24,Neutral,Arabic
20462912-58fa-44d2-a9d7-be67b1315a34,2025-12-25,Facebook News Pages,Energy sector to invest $255 in innovation hub,Masdar has announced a strategic partnership in its latest move to regulate the market.,Masdar,Energy,0.4,Positive,English
209f6af3-f9f8-494d-9081-eb2a37cbb103,2025-04-30,Khaleej Times,DIFC reports significant decline in annual results,"In a recent interview, Spokesperson stated that DIFC will hire more staff in the coming months.",DIFC,Finance,0.46,Positive,English
936ffb93-92f4-4ca0-9f67-26a83d2f279c,2020-07-29,Emirates 24/7,Dubai South reports mixed results in Q4 results,The framework introduced by Dubai Government is expected to regulate the real estate sector.,Dubai South,Real Estate,-1.0,Negative,English
a191c9ce-ce24-4190-a0ce-513bd33047df,2021-03-26,Bloomberg MENA,Souq.com raises $85 in Series C funding,Souq.com has announced a major expansion in its latest move to enhance services.,Souq.com,Tech,0.7,Positive,English
674f6ee3-46d6-4381-b5d6-3b6c131bd48a,2022-08-13,Dubai Media Office,.ﺎﻴﺟﻮﻟﻮﻨﻜﺗ ﺕﺍﺭﺎﻘﻋ ﻉﺎﻄﻗ ﻮﻤﻧ ﻉﻭﺮﺸﻣ,.ﺕﺍﺭﺎﻣﻻﺍ ﺎﻴﺟﻮﻟﻮﻨﻜﺗ ﻉﻭﺮﺸﻣ ﺩﺎﺼﺘﻗﺍ ﻲﺑﺩ ﺔﻴﻟﺎﻣ ﻮﻤﻧ ﺭﻮﻄﺗ,Dubai South,Real Estate,0.16,Neutral,Arabic
